,date,text
4011,2020-02-06,"Poxa, lamento que isso tenha ocorrido . Informe em qual agência vc buscou atendimento e o seu CPF na DM, por favor."
4012,2020-02-06,"Oi, Rodrigo! É possível a personalização de limites no App BB em: Meus Limites > Atribuir Limite Máximo, feito isso basta confirmar o novo limite em um caixa eletrônico do BB. Lembro que também é possível a habilitação do BB Code onde os limites serão multiplicados em 10x!"
4013,2020-02-06,"Não sou Capitu!!"")"")"
4014,2020-02-06,"Imagina, eu gosto de mimar meus clientes! "
4015,2020-02-06,
4016,2020-02-06,Espera chegar o Banco Grêmio pra cê ver
4017,2020-02-06,"@BancodoBrasil olá, tudo bem? mandei uma DM para vocês. olhem lá, por favor "
4018,2020-02-06,"Acabei de fazer um pedido pra abrir conta no @Bancointer, porque, além de ser melhor, não me cobra a taxa absurda que o @BancodoBrasil tá me cobrando pra ter conta corrente. BB, 16 reais por mês de anuidade mais 8,50 por TED? Tomar no cu né"
4019,2020-02-06,"Olá, Junior! Estou muito feliz por isso! Informe seu CPF na DM que te ajudo sobre o limite."
4020,2020-02-06,"Oi, Amanda! Informe seu CPF na DM pra eu ver certinho o que houve."
4021,2020-02-06,"Poxa, o que houve? Se desejar uma consulta detalhada, informe seu CPF na DM."
4022,2020-02-06,Que jeito irmão
4023,2020-02-06,"Oi, Leonardo! Ocorreu uma inconsistência no acesso ao App, já estamos trabalhando para normalizar a situação. ;)"
4024,2020-02-06,anda banco do Brasil a rafaela essa selecionando a sua firma para dar um emprego à ela
4025,2020-02-06,eu tenho o inter
4026,2020-02-06,Baixa a taxa mensal da conta corrente aí
4027,2020-02-06,"Olá, Eduardo! Informe seu CPF na DM pra que eu possa te ajudar com mais segurança."
4028,2020-02-06,"Oi, Thiago! É possível pedir a 2ª Via de Comprovante de Pagamento no App BB em: Pagamentos > 2ª Via de Comprovante de Pagamento."
4029,2020-02-06,"Fala, Rodrigo! É necessário apresentar o Ourocard usado na compra dos ingressos na hora de entrar na #BGS2020. Caso não haja realmente um jeito de levar o cartão do seu amigo, você pode fazer o seu aqui: http://bit.ly/2Ry2Caf É molezinha! :)"
4030,2020-02-06,"Olá, Jonata! Me chama na DM com seu CPF, pra eu ver certinho o que houve com sua anuidade."
4031,2020-02-06,@BancodoBrasil como faz pra conseguir esse bendito código do ibam e swift ???
4032,2020-02-06,Pede ajuda pro Bradesco que teve lucro de 20 bilhões em 2019.
4033,2020-02-06,De boas no @BancodoBrasil e começa a tocar My Heart Will Go On ( Música do Titanic) KKKKKKKKKKKKKK
4034,2020-02-06,"Tem alguma build que dá pra encaixar um cutelinho? Lembro que em 2018/19 eu fazia colhedor,cutelo,gume, canhão e drakthar"
4035,2020-02-06,"Nenhum banco manda pedir dados por sms e/ou email, é golpe e eles levam tudo o que puderem."
4036,2020-02-06,não
4037,2020-02-06,Nunca deu certo ??
4038,2020-02-06,Olá! Qual a sua dificuldade no App?
4039,2020-02-06,@BancodoBrasil 
4040,2020-02-06,"Respondi sua mensagem na DM, conversamos por lá!"
4041,2020-02-06,eu to com tanta raiva @BancodoBrasil lixo
4042,2020-02-06,@BancodoBrasil
4043,2020-02-06,Tocando KLB no som interno do @BancodoBrasil ... lembra muito o domingo legal com o @guguliberato
4044,2020-02-06,ficar em banco é um inferno @BancodoBrasil como que vcs colocam SÓ uma pessoa pra atender????
4045,2020-02-06,Queria muio poder palestrar este ano no estande de vcs lá na #BGS2020 e poder falar das Assimerias Cranianas que ocorrem nas crianças... vamos conversar sobre esta possibilidade?
4046,2020-02-06,@BancodoBrasil obrigado pelo mimo BB. Adorei. O BB sempre me surpreendendo com coisas boas!
4047,2020-02-06,Que ódio
4048,2020-02-06,"Parabéns BB pelo prêmio não esperava nada diferente deste ótimo Banco , já que hj e dia de festa para comemorar esse prêmio poderia dar um presente para este seguidor seu um almento de limite do meu CCredito ? Será que rola?"
4049,2020-02-06,"Poxa, o que eu fiz? "
4050,2020-02-06,Hahahaha Vossa Excelência se esqueceu que eu presto serviço para um banco? Melhore!
4051,2020-02-06,"@BancodoBrasil vocês são burocráticos e retrógrados nos serviços, a vida financeira da minha empresa virou um pesadelo, aguardem o encerramento da minha conta, vou ali com os concorrentes digitais por que pelo menos a resolução dos meus problemas fica a uma ligação de distância."
4052,2020-02-06,"quero comprar o ingresso com o cartão Ourocard @BancodoBrasil de um amigo,mas não posso levá-lo para o evento para apresentar na entrada pra confirmar a compra e confirmar o desconto. como proceder? @BrasilGameShow"
4053,2020-02-06,"@BancodoBrasil vamos melhorar os serviços de financiamento imobiliário, + de 3 meses pra realizar um financiamento, e o cenopi só responde os email quando quer, o 4004 0001 não sabe da informações, e a agência não resolve nada. Além disso, Cancelam a sua proposta. Parabéns!"
4054,2020-02-06,Cada vez mais difícil utilizar o @BancodoBrasil. O caixa eletrônico não lê meu cartão. Tento usar a biometria e não identifica minha digital.
4055,2020-02-06,Pede para esse fanfarrão explicar o spread praticado pelo BB mesmo com esse cenário de queda da SELIC. Deixem de ser dissimulados e passem a trabalhar pelo país. Ou privatizar logo.
4056,2020-02-06,não já me roubaram muito
4057,2020-02-06,Vem p Itaú
4058,2020-02-06,Desta vez os ingressos da BGS já estão a venda para os clientes Ourocard do @BancodoBrasil show a stand foi perfeita nos dias da feira top Tmj #TamoJuntoNesseGame
4059,2020-02-06,"Horrível, mais de uma hora esperando e só um guichê de atendimento funcionando. E os funcionários andando a agência para baixo e para cima, conversando, como se não tivessem que trabalhar."
4060,2020-02-06,@BancodoBrasil cade meu comprovante de pagamento?
4061,2020-02-06,tá tudo travado não consigo fazer depósito transferência e nem sacar aff 
4062,2020-02-06,se vcs tiverem a oportunidade de fazer um cartão de crédito no @BancodoBrasil NÃO FAÇAM!!! eles ligam oferecendo falando que não paga anuidade aí 6 meses depois eles vem com uma anuidade de 370 reais nem meu salário eu vou receber mais nessa bosta de banco
4063,2020-02-06,Estou chamando vocês na DM
4064,2020-02-06,@BancodoBrasil é horrível esse app pqp
4065,2020-02-06,"Fala, Iarley. Me manda uma DM pra gente ver o que pode ser feito. ;)"
4066,2020-02-06,"O que acontece primeiro: - @governosp limpar o Pinheiros - @bancoDoBrasil não diminuir automaticamente meus limites de transação mas, se fizer, permitir que eu ajuste pelo app sem ir para uma agência - @Palmeiras ganhar ou copinha ou mundial O 3 é impossível, e os outros dois?"
4067,2020-02-06,Olá! Há uma indisponibilidade no app que já estamos trabalhando para regularizar.
4068,2020-02-06,Me manda uma DM com sua agência e conta ou CPF pra eu verificar o ocorrido e te orientar certinho.
4069,2020-02-06,Muito obrigado!!!! Tá rapidão na resposta hein 
4070,2020-02-06,Essa agência opera câmbio e comercializa Visa Travel Money. ;)
4071,2020-02-06,"10. Finalmente, quando chamarem a sua senha, grita BINGO! Valeu!"
4072,2020-02-06,"9. Mais uma, essa é básica, mas muita gente não faz, e acaba atrasando a sua vida e a dos amiguinhos! Meu, liga pro banco antes e pergunta tudo o que tem que levar! Cópia do RG, CPF, amostra de urina, o que for... se organiza e leva antes! A gente agradece!"
4073,2020-02-06,"8. Outra sugestão pra quem não foi preparado, que nem eu, é encontrar um amiguinho divertido e falar umas besteiras tipo essas da thread. Agradeço a amiguinha que colou em mim e fez o tempo passar um pouco mais rápido!"
4074,2020-02-06,"7. Falando em senha, não dá pra entender os esquemas das senhas! Lá no BB, tem AS, AZ, AN, JN... não tem nem como saber se vc vai ser o próximo. Então, se vc não foi pro banco preparado (que nem eu), pode brincar de decifrar os códigos do banco!"
4075,2020-02-06,@BancodoBrasil consegue descobrir pra mim se a agência 1380 (Tres coroas/RS) emite Visa Travel Money? Obrigado 
4076,2020-02-06,"6. Cara, leva um lanchinho também, porque no banco só tem água, no máximo um café. Já vi também biscoitinhos, mas pra quem é fitness não rola! E se tiver que ir ao banheiro, cuidado com a senha!"
4077,2020-02-06,Olá! Me manda uma DM com sua agência e conta ou CPF pra eu verificar o ocorrido e te orientar certinho.
4078,2020-02-06,"5. Pra quem é estudante, se tiver alguma coisa pra ler, nossa, dá pra ler uns 2 textos fácil (eu além de ser professora, sou aluna de pós, tem coisa pra corrigir e ler sempre, então, não dá pra perder tempo, não é verdade?"
4079,2020-02-06,"3. Leva um crochê, um trico (é assim que escreve?). Essa é pra galera dos trabalhos manuais. 4. Professores, levem umas provas pra corrigir. Dá pra adiantar muita coisa e é melhor do que levar pra casa!"
4080,2020-02-06,Olá! Me manda uma DM com sua agência e conta ou CPF pra eu verificar o ocorrido e te orientar certinho.
4081,2020-02-06,O do @Bradesco é pior!
4082,2020-02-06,Olá! Me manda uma DM com sua agência e conta ou CPF pra eu verificar o ocorrido e te orientar certinho.
4083,2020-02-06,"2. Leva um baralho! Aí você chama os amiguinhos que estão ali também pra jogar uma canastra, quem sabe até um pokerzinho, pode até apostar dinheiro, porque já estão no banco mesmo. Fica ligado pra não perder a senha!"
4084,2020-02-06,"Ai @BancodoBrasil eu ando tão, mas tão decepcionada com vc... Não dá pra fazer NaDA com o app TUDO manda pra agência. Que agência?!?!?! Se vcs me jogaram pra um gerente virtual??? Eu pago tx pra me estressar e só! "
4085,2020-02-06,"Tá, agora, segue umas sugestões pra quem vai pro banco, além de levar um livro, como sugeriu o servidor do BB. 1. Leva o celular carregado e leva o carregador também (esse é básico né gente?)"
4086,2020-02-06,Olha que gracinha ela trabalhando
4087,2020-02-06,E aqui temos um bot. Continua péssimo hein!
4088,2020-02-06,Sempre foi ruim. A minha primeira conta foi nesse banco. E a melhor coisa que fiz nesse banco foi encerrar essa conta.
4089,2020-02-06,Tá difícil hj hein? Atrapalhando meu dia.
4090,2020-02-06,@BancodoBrasil Tá difícil hj hein? Atrapalhando meu dia. Devolvam meu app
4091,2020-02-06,"Olá! Me manda uma DM com sua agência e conta, e me explica melhor o que aconteceu."
4092,2020-02-06,"De todos os atendimentos bancários ruins o do @BancodoBrasil consegui hoje ser o pior! Atendimento péssimo, fala de funcionário e demora descomunal no atendimento."
4093,2020-02-06,"Vou notificar essa para providências. Se for possível, só me envia por DM o seu CPF para o registro. "
4094,2020-02-06,"O @BancoCentralBR abaixou a Taxa #Selic para 4,2% Mas o juros do @nubank ainda está 5.2% podendo chegar a 14% Isso porque não vamos falar de @Bradesco @itau @Caixa @BancodoBrasil @santander_br que passam doa 300% de juros"
4095,2020-02-06,O atendimento na DM passou para um funcionário do BB. Vamos conversar por lá!
4096,2020-02-06,@ObraboWill @VLacerdaaa @joaogiuzeppe
4097,2020-02-06,"Ontem fui nos @CorreiosBR no Centro de distribuição no Paraíso/SP pegar meu cartão do @BancodoBrasil, eu trabalho o dia todo, com meus documentos. O funcionário disse que, por medida de segurança só no endereço. Vou perder a entrega da correspondência. Em pleno 2020. #Vergonhoso."
4098,2020-02-06,"Foi uma indisponibilidade no sistema, Malu. Não só no app. Escrevi errado... :) Mas a situação já foi regularizada. ;)"
4099,2020-02-06,Olá! Me manda uma DM com sua agência e conta ou CPF pra eu verificar o ocorrido e te orientar certinho.
4100,2020-02-06,Olá! Me manda uma DM com sua agência e conta ou CPF pra eu verificar o ocorrido e te orientar certinho.
4101,2020-02-06,Olá! Me manda uma DM com sua agência e conta ou CPF pra eu verificar o ocorrido e te orientar certinho.
4102,2020-02-06,Quero estar junto de vcs novamente @BancodoBrasil esse ano na maior feira de gamer melhor STAND da BGS #bancodobrasil de
4103,2020-02-06,"Olá! Me manda uma DM com sua agência e conta, e me explica melhor o que aconteceu."
4104,2020-02-06,"@BancodoBrasil tive um problema para atualizar endereço pelo app , mesmo anexando comprovante ( nome do meu cônjuge, pois n tenho nenhuma correspondência em meu nome ) ignorou :( Me ajuda mais tarde ? :)"
4105,2020-02-06, 
4106,2020-02-06,Uma puta burocracia para pegar senha no @BancodoBrasil
4107,2020-02-06,"consigo fazer o login, mas não consigo utilizar nenhuma função dentro do app nem no site"
4108,2020-02-06,"Olá! Manda pra mim uma DM com o prefixo ou endereço da agência que vc foi, e seu CPF pra eu registrar sua interação."
4109,2020-02-06,Olá! Houve uma indisponibilidade no app que já foi regularizada! Vc ainda não consegue acessar sua conta?
4110,2020-02-06,Pqp mermo
4111,2020-02-06,Olá! Me manda uma DM com sua agência e conta ou CPF pra eu verificar o ocorrido e te orientar certinho.
4112,2020-02-06,"Desde 7h fora do ar, não passa cartão, não faz transferência, não acessa nada, uma bosta"
4113,2020-02-06,"Olá! Me manda uma DM com sua agência e conta, e me explica melhor o que aconteceu."
4114,2020-02-06,"Olá! Me manda uma DM com sua agência e conta, e me explica melhor o que aconteceu."
4115,2020-02-06,Amiga meu app foi bloqueado tb
4116,2020-02-06,"Em um ciclo de queda desde julho, a #Selic atingiu a mínima histórica mais uma vez. Veja a análise do meu economista-chefe, Ronaldo Távora, e descubra como a decisão do Copom afeta a economia e seus investimentos: https://youtu.be/VEpE9IcHUiU #EconomiaEmFoco #InvesTalk"
4117,2020-02-06,"Olá @BancodoBrasil, porque no site, na parte de cartões eu vejo 3 cartões, 2 deles que eu nunca tive, ou vi?"
4118,2020-02-06,. @governoparana e @BancodoBrasil financiarão construção de moradias para agricultores familiares - http://cohapar.pr.gov.br/Noticia/Governo-do-Parana-e-Banco-do-Brasil-financiarao-construcao-de-moradias-para-agricultores
4119,2020-02-06,Amigo não dá pra fazer pelo App?? Eu faço tudo por lá
4120,2020-02-06,"@BancodoBrasil seu app e site ta uma merda, me ajuda a te ajudar bixo"
4121,2020-02-06,"@BancodoBrasil um banco onde seu funcionário trata o cliente com falta de educação,não merece cuidar do meu dinheiro . Cancelei minha conta mesmo "
4122,2020-02-06,4 anos depois.... conseguiu? kkk
4123,2020-02-06,Olá! Me manda uma DM com sua agência e conta ou CPF pra eu verificar o ocorrido e te orientar certinho.
4124,2020-02-06,"Ei, Rodrigo! É possível negociar o ETF ISUS11 que segue o índice ISE. Continuamos à disposição para te ajudar!"
4125,2020-02-06,@BancodoBrasil como faço pra consultar o pasep sendo que a Desgraça do site de vocês não funciona?? Qual é a outra opção?? 
4126,2020-02-06,"Fato 1 - Validade do cartão de crédito chegou ao fim Fato 2 - Pedi reposição p o @BancodoBrasil, q PERDEU o novo cartão (está em alguma gaveta da agência, diz a GERENTE DE CONTA) Fato 3 - Tenho q fazer um novo pedido de cartão, e o banco ME COBRA a segunda emissão (segue)"
4127,2020-02-06,Olá! Me manda uma DM com sua agência e conta ou CPF pra eu verificar o ocorrido e te orientar certinho.
4128,2020-02-06,"A página pra entrar na conta nem aparece, isso no site via pc o App é ótimo"
4129,2020-02-06,"Olá! Me manda uma DM com sua agência e conta, e me explica melhor o que aconteceu."
4130,2020-02-06,"Bom, de qualquer forma, o ""selo"" representa o esforço do banco para combater a corrupção EXTERNA. Quando vão passar a combater a CORRUPÇÃO INTERNA, das vendas casadas e produtos empurrados como o que não são???"
4131,2020-02-06,Olá! Não consigo iniciar DM. :( Peço que acesse meu perfil e me manda a DM por lá. ;)
4132,2020-02-06,"Prova de que esse selo fajuto não vale muita coisa. Ético? E às vendas casadas? Alguém nessa vida já comprou ourocap sem ser forçado por um funcionário? Ou enganado pela ""poupança que dá prêmios""? Quanta balela. Conta outra. ""Ética"" kkkk"
4133,2020-02-06, 
4134,2020-02-06,O atendimento mais inútil que existe é definitivamente o do @BancodoBrasil via WhatsApp ! Jesus amado !
4135,2020-02-06,"Estou muito feliz em ganhar pela 3º vez o selo Pró-Ética, que certifica empresas de diversos ramos que promovem o combate a fraudes e corrupção. Ser reconhecido por boas ações é muito bom, por isso mantenho o esforço conjunto na promoção da ética e integridade. #MaisQueDigital"
4136,2020-02-06,"@BancodoBrasil por gentileza, podem me chamar na dm?perdi minha senha q o caixa eletrônico emite, preciso ir so banco pessoalmente? conta empresarial"
4137,2020-02-06, 
4138,2020-02-06,Olá! Me manda uma DM com sua agência e conta ou CPF pra eu verificar o ocorrido e te orientar certinho.
4139,2020-02-06,O atendimento na DM passou para um funcionário. Vamos conversar por lá!
4140,2020-02-06,Olá! Me manda uma DM com sua agência e conta ou CPF pra eu verificar o ocorrido e te orientar certinho.
4141,2020-02-06,Olá! Me manda uma DM com sua agência e conta ou CPF pra eu verificar o ocorrido e te orientar certinho.
4142,2020-02-06,Olá! Me manda uma DM com sua agência e conta ou CPF pra eu verificar o ocorrido e te orientar certinho.
4143,2020-02-06,Olá! Me manda uma DM com sua agência e conta ou CPF pra eu verificar o ocorrido e te orientar certinho.
4144,2020-02-06,Olá! Há uma indisponibilidade no sistema que já estamos trabalhando para regularizar.
4145,2020-02-06,Olá! Há uma indisponibilidade no app que já estamos trabalhando para regularizar.
4146,2020-02-06,@BancodoBrasil responde minha DM! Assistente Virtual não tá ajudando em nada. 
4147,2020-02-06,Olá! Há uma indisponibilidade no app que já estamos trabalhando para regularizar.
4148,2020-02-06,"putssss, isso que é atendimento! aprende, @BancodoBrasil pq até coação a pegar empréstimo eu tive que aguentar esses dias e precisei prestar queixa no banco central para que, aí sim, o gerente geral ligasse pra resolver o problema"
4149,2020-02-06,"@BancodoBrasil PARA DE ME COBRAR POR SERVIÇOS QUE EU NEM USEI CARALHO, BANDO DE LADÃO"
4150,2020-02-06,Como diz o ditado: EITA
4151,2020-02-06,"Caso a dificuldade persista, ligue para o telefone 0800 329 1242. "
4152,2020-02-06,"Minha bolsa mal caiu na conta e o @BancodoBrasil já descontou essa taxa absurdamente alta, pra uma conta universitária."
4153,2020-02-06,"@BancodoBrasil vocês me cobraram duas vezes a fatura do meu cartão de crédito, uma dúvida na hora do extorno vocês vão me devolver os juros da aplicação automática já que demoram 3 dias para processar um pagamento dentro da própria instituição?"
4154,2020-02-06,Olá! Há uma indisponibilidade no app que já estamos trabalhando para regularizar.
4155,2020-02-06,"Olá! Me manda uma DM com sua agência e conta, e me explica melhor o que aconteceu."
4156,2020-02-06,Olá! Há uma indisponibilidade no app que já estamos trabalhando para regularizar.
4157,2020-02-06,Olá! Há uma indisponibilidade no sistema que já estamos trabalhando para regularizar.
4158,2020-02-06,Olá! Há uma indisponibilidade no app que já estamos trabalhando para regularizar.
4159,2020-02-06,Olá! Há uma indisponibilidade no app que já estamos trabalhando para regularizar.
4160,2020-02-06,recuperando rápido e animado!
4161,2020-02-06,"Indisponibilidade no sistema, Alex. ;)"
4162,2020-02-06,Olá! Há uma indisponibilidade no app que já estamos trabalhando para regularizar.
4163,2020-02-06,"Muito constrangimento, inaceitável!"
4164,2020-02-06,Exato!
4165,2020-02-06,"Não somente no app, mas no cartão também, fui usar meu cartão de débito e não consegui!! Fiquei na mão e constrangido, mesmo saldo sendo positivo."
4166,2020-02-06,"@BancodoBrasil ta acontecendo alguma coisa com o sistema de vocês hoje ? Tentei passar o cartão de crédito e não consegui, tentei a opção debito e também nada ! E isso aconteceu com mais pessoas na farmacia que tentaram utilizar cartão de crédito do bb."
4167,2020-02-06,João :D
4168,2020-02-06,Olá! Há uma indisponibilidade no app que já estamos trabalhando para regularizar.
4169,2020-02-06,Se eu fosse vcs agilizava a parada... Vcs não vão querer conhecer o senhor deep web do twitter mais a fundo!
4170,2020-02-06,DM :]
4171,2020-02-06,Olá! Há uma indisponibilidade no app que já estamos trabalhando para regularizar.
4172,2020-02-06,Olá! Me manda uma DM com sua agência e conta ou CPF pra eu verificar o ocorrido e te orientar certinho.
4173,2020-02-06,Olá! Há uma indisponibilidade no app que já estamos trabalhando para regularizar.
4174,2020-02-06,Olá! Há uma indisponibilidade no app que já estamos trabalhando para regularizar.
4175,2020-02-06,Olá! Há uma indisponibilidade no app que já estamos trabalhando para regularizar.
4176,2020-02-06,"Olá! Manda pra mim uma DM com o prefixo ou endereço da agência que vc foi, e seu CPF pra eu registrar sua interação."
4177,2020-02-06,Olá! Há uma indisponibilidade no app que já estamos trabalhando para regularizar.
4178,2020-02-06,Olá! Há uma indisponibilidade no app que já estamos trabalhando para regularizar.
4179,2020-02-06,Olá! Há uma indisponibilidade no app que já estamos trabalhando para regularizar.
4180,2020-02-06,Olá! Há uma indisponibilidade no app que já estamos trabalhando para regularizar.
4181,2020-02-06,Olá! Há uma indisponibilidade no app que já estamos trabalhando para regularizar.
4182,2020-02-06,"Eu q nem conta tenho lá, recebo hahahaha"
4183,2020-02-06,@BancodoBrasil te chamei na DM!
4184,2020-02-06,olá! Respondi sua DM
4185,2020-02-06,"O meu também e ligo para esse 0800 todos os dias, me dizem que o setor responsavel entrara em contato, já se passaram 5 dias e nada"
4186,2020-02-06,@BancodoBrasil fora do ar pela primeira vez em mil anos. Deve ser esse governo sucateando propositalmente para vender a preço de banana.
4187,2020-02-06,Olá! Respondi sua DM.
4188,2020-02-06,Ja retornei
4189,2020-02-06,Olá! Respondi sua DM.
4190,2020-02-06,Eita
4191,2020-02-06,Não é só no aplicativo. É geral!
4192,2020-02-06,Como que vou fazer transação se o saldo está defasado? @BancodoBrasil 
4193,2020-02-06,Olá! Respondi sua DM.
4194,2020-02-06,"@BancodoBrasil e aí pessoal vcs não vão dar uma satisfação ? Desde 6 horas da manhã tentando usar o aplicativo, pagar com o cartão e sacar dinheiro, e não obtive sucesso, isso é um desrespeito. "
4195,2020-02-06,@BancodoBrasil se espelhem no @nubank e sejam mais honestos com os clientes
4196,2020-02-06,Olá! Há uma indisponibilidade no app que já estamos trabalhando para regularizar.
4197,2020-02-06,Aconteceu comigo tbm. Débito e crédito Elo. No Ourocard Visa passou
4198,2020-02-06,Olá! Há uma indisponibilidade no app que já estamos trabalhando para regularizar.
4199,2020-02-06,"Como dar orgulho pra @nathfinancas se o débito não funciona??? Pô, @BancodoBrasil me ajuda a não decepcionar essa diva!!!!"
4200,2020-02-06,Olá! Há uma indisponibilidade no app que já estamos trabalhando para regularizar.
4201,2020-02-06,"Não consigo acessar o app, meu cartão não tá passando nas maquininha de cartão e no banco os caixa tão todos dizendo ""terminal indisponível"" Aí não dá, né @BancodoBrasil"
4202,2020-02-06,"Alô @BancodoBrasil , a minha compra não foi permitido, porém observei o extrato e foi debitado em conta! Galera fiquem atentos aos seus extratos! Alguém mais?"
4203,2020-02-06,Olá! Há uma indisponibilidade no app que já estamos trabalhando para regularizar. ;)
4204,2020-02-06,Olá! Há uma indisponibilidade no app que já estamos trabalhando para regularizar. ;)
4205,2020-02-06,Olá! Há uma indisponibilidade no app que já estamos trabalhando para regularizar. ;)
4206,2020-02-06,Esse app hj do @BancodoBrasil tá dando erro igual a minha vida
4207,2020-02-06,Olá! Há uma indisponibilidade no app que já estamos trabalhando para regularizar. ;)
4208,2020-02-06,Ok. Muito obrigado abraços.
4209,2020-02-06,"Oie, depois de mt tentar eu consegui. Mas vou mandar dm pra verificarem o porquê do meu app estar bloqueado."
4210,2020-02-06,somente o saldo da conta que está com problema no @BancodoBrasil SO-MEN-TE
4211,2020-02-06,Valeu obrigado 
4212,2020-02-06,Olá! Há uma indisponibilidade no app que já estamos trabalhando para regularizar. ;)
4213,2020-02-06,@BancodoBrasil colocou uma mensagem no app falando que dá pra fazer as transações normalmente. Como eu vou fazer transação sem poder ver o saldo da conta?
4214,2020-02-06,Olá! Há uma indisponibilidade no app que já estamos trabalhando para regularizar. ;)
4215,2020-02-06,@catbrowdog Olá! Há uma indisponibilidade no app que já estamos trabalhando para regularizar.
4216,2020-02-06,Banco do Brasil normalmente como se está tudo fora do ar? @BancodoBrasil 
4217,2020-02-06,Olá! Há uma indisponibilidade no sistema que já estamos trabalhando para regularizar.
4218,2020-02-06,Olá! Há uma indisponibilidade no app que já estamos trabalhando para regularizar.
4219,2020-02-06,Olá! Há uma indisponibilidade no sistema que já estamos trabalhando para regularizar.
4220,2020-02-06,Os cara começam a trabalhar cedo migo. Hahaha
4221,2020-02-06,Olá! Há uma indisponibilidade no app que já estamos trabalhando para regularizar.
4222,2020-02-06,Olá! Há uma indisponibilidade no app que já estamos trabalhando para regularizar.
4223,2020-02-06,Vou fundar um banco pra sugar os bestas. Hehe.
4224,2020-02-06,"@BancodoBrasil é uma beleza essas tarifas cobradas pelo banco, né? Ontem não consegui tirar dez reais por conta de 0,41 R$que me cobraram (até aí ok). Já hoje não apenas 0,41 os centavos de tarifa, mas sumiram os 9,59 R$que tinham lá."
4225,2020-02-06,Olá! Há uma indisponibilidade no app que já estamos trabalhando para regularizar.
4226,2020-02-06,@BancodoBrasil tá tudo fora do ar? Fui pagar um negócio e meus cartões foram recusados
