,date,text
1329,2020-02-21,"Como uma empresa, criada por 2 bancos - @Bradesco e @BancodoBrasil - não tem um sistema minimamente satisfatório de cobrança? Como debitam 2 faturas 2 vezes em um intervalo de 2 dias? Detalhe: antes da 2ª cobrança entrei em contato e me garantiram que não ocorreria. (...)"
1330,2020-02-21,"Essa mensagem não é do BB, é fraude. Peço por gentileza que envie uma cópia dela para abuse@bb.com.br. É meu canal de denúncias para esse tipo de golpe."
1331,2020-02-21,Olá! Me manda uma DM com sua agência e conta ou CPF pra eu verificar o ocorrido e te orientar certinho.
1332,2020-02-21,Olá! Me manda uma DM com sua agência e conta ou CPF pra eu verificar o ocorrido e te orientar certinho.
1333,2020-02-21,Olá! O que acontece?
1334,2020-02-21,"Olá! Me manda uma DM com sua agência e conta, e me explica melhor o que aconteceu."
1335,2020-02-21,"Se vc tiver uma conta com código de barras, vc consegue incluir em qualquer canal de autoatendimento. Vc vai achar a opção no menu ""pagamento"". ;)"
1336,2020-02-21,@kaiquedanntas Olá! A personalização de limites de pagamento não é tarifada. ;)
1337,2020-02-21,"Olá! Me manda uma DM com sua agência e conta, e me explica melhor o que aconteceu pra eu te ajudar. ;)"
1338,2020-02-21,"Ja tentei varias vezes o banco alega que tenho de requerer o extrato microfilmado, no caso e do periodo de70 a 88, e entrar na justiça, mas e os meus direitos, o governo liberou o pagamento, inclusive sobre o periodo.Tenho conta pouança.CPF 662673237-49.E o extrato demora 2 meses"
1339,2020-02-21,@BancodoBrasil mandei uma DM na 3a
1340,2020-02-21,"Active and undetected phishing against @BancodoBrasil on @1und1 infrastructure. Same IP, pages have been up for 20+ hours and no detection on Google Safe Browsing. Scans: https://urlscan.io/result/04004627-92ff-480d-bf5b-0edf814e8982 and https://urlscan.io/result/240ee0f0-45a8-4799-a0cb-a067bc1d545a/ @Bank_Security @dave_daves Happy hunting!"
1341,2020-02-21,"Olá, Nico! Através do site http://www.naomeperturbe.com.br/ você pode cadastrar o seu número para o não recebimento das ligações. O bloqueio ocorrerá em até 30 dias após a solicitação, de acordo com a Lei Não Perturbe. Obrigado."
1342,2020-02-21,"as ligações são dos lugares pros quais obviamente devo: @santander_br, @BancodoBrasil, @Bancointer, @falanext, @ClaroBrasil e @meupag (que, aliás, tá me cobrando pelo golpe que me deu). é o auge do absurdo a quantidade de vezes que me ligam, e não para de aumentar."
1343,2020-02-21,"Eu pensava que o valor dos juros anuais seriam algo próximo da inflação, não esses 8,4% anuais "
1344,2020-02-21,"o dia fechou em 98 ligações de cobrança, entre 8h e 18h (período de 10 horas) são 9,8 ligações por hora praticamente uma ligação a cada sete minutos e tem momentos que são 3 ligações seguidas em 15 segundos @santander_br, @ClaroBrasil, @meupag, @BancodoBrasil: vocês são loucos. "
1345,2020-02-21,baixa TU
1346,2020-02-21,@BancodoBrasil pra fechar conta preciso ir na minha agência? Único serviço que eu usava era o Western Union e só me dá erro no últimos 6 meses a ponto que ir numa agência do WU é mais fácil que tentar receber pelo aplicativo ou ir numa agência do banco que fecha às 16h.
1347,2020-02-21,Mudei tudo para @BancodoBrasil ! 100% top!
1348,2020-02-21,O vinheteiro vai direto pro private..
1349,2020-02-21,"@petrobras (PETROBRÁS) @Caixa (CAIXA ECONÔMICA) @BancodoBrasil (BANCO DO BRASIL) REGISTRAM LUCRO RECORDE! Efeito @jairbolsonaro, e não adianta teimar e fingir que não, quem deu o pontapé nessa política de MERITOCRACIA onde a ladroagem não tem vez foi o mito! Rumo à 2022!"
1350,2020-02-21,@jairbolsonaro @BancodoBrasil @Caixa @mdregional_br @VEJA @GloboNews @BandJornalismo @SBTonline @olhardigital @camaradeputados @SenadoFederal
1351,2020-02-21,Peço ao @BancodoBrasil que olhe minha DM pelo amor
1352,2020-02-21,"Como disse o @ProfBunazar, parabéns ao @BancodoBrasil por não cobrar tarifas no cheque especial, porém, reduzir os limites de um cliente de quase vinte anos é uma verdadeira injustiça. #BBLixo"
1353,2020-02-21,#SomosTodosBolsonaro
1354,2020-02-21,#carnaval
1355,2020-02-21,"Neste carnaval, fantasie seu cartão. Assim você não troca gato por lebre (seu cartão por uma cópia) #golpes #Carnaval2020 @nubank @FEBRABAN @Caixa @BancodoBrasil @C6Bank"
1356,2020-02-21,"Next kkkkkkk app devagar e, testei esses dias no iPhone, usa o sensor de proximidade como se fosse app de ligação telefônica. Tem bastante coisa pra melhorar no Next, incluindo que não consegui emitir cartão virtual ATÉ AGORA"
1357,2020-02-21,bb e next > qualquer um desses aí
1358,2020-02-21,Caixa tapete se BB
1359,2020-02-21,só o do @BancodoBrasil me interessa melhor banco ever
1360,2020-02-21,@BancodoBrasil o atendimento de vocês pelo telefone se melhorar fica péssimo.
1361,2020-02-21,@Brunozor tá em todas ein mano
1362,2020-02-21,"Lançada, hoje, linha de crédito para o pré-custeio da safra 2020/2021, pelo @BancodoBrasil. As operações terão taxa de juros a partir de 6% ao ano e devem atender 750 mil produtores rurais. "
1363,2020-02-21,"Lançada, hoje, linha de crédito para o pré-custeio da safra 2020/2021, pelo @BancodoBrasil. As operações terão taxa de juros a partir de 6% ao ano e devem atender 750 mil produtores rurais. "
1364,2020-02-21,"Só a decepção com minha linda agência viu BB! E até com você, pois, aposto que nem sabe do que estou falando enquanto deveria ser o meu parceiro e me ouvir bem! "
1365,2020-02-21,"O Pedro Guimarães @Caixa é um EXCELENTE Gestor Público. PARABÉNS 1ºBaixou o Juros Ch Especial 2ºA CEF lucrou 8 bilhões 3º tri 2019 3ºAngariou 1 milhão novos clientes Sugiro reduzir, tb, Juros Cartão Crédito p desespero dos bancos @itau @Bradesco @santander_br e @BancodoBrasil "
1366,2020-02-21,"Alô @BancodoBrasil, que tal um cliente Estilo?"
1367,2020-02-21,Ministra @TerezaCrisMS dando show!
1368,2020-02-21,"@Bancointer olha só, podia pedir para a @letyguntin fazer um pra ti"
1369,2020-02-20,Enviei a DM
1370,2020-02-20,@BancodoBrasil ei.. meu cartão não deveria ter chegado já? Criei a conta no dia 03/02 e até agora 
1371,2020-02-20,@BancodoBrasil shiiiii hhahahahah
1372,2020-02-20,Já mandei via DM mas é uma assistente virtual que vai resolver isso pra mim ?
1373,2020-02-20,"Olá, humano por aqui. Compreendi a situação, porém como meu assistente virtual e meu colega, já solicitaram eu preciso que me informe o seu CPF, para que eu verifique o status de seu PASEP, e possa orientá-lo sobre as possibilidades de resgate. Ok? Fico no aguardo."
1374,2020-02-20,me chama na DM com o seu CPF que eu te ajudo por lá.
1375,2020-02-20,Alguém dessa rede social sabe me falar como que cadastra uma conta (@TIMBrasil ) pra débito automático no @BancodoBrasil? Pq o SAC é um lixo e o atendimento de cartões não funciona.
1376,2020-02-20,"Jesus, para solicitar o cartão de crédito, vc precisa ter visto permanente e CPF. Vem no meu site que te dou 1 passo a passo pra pedir meu cartão "
1377,2020-02-20,Carnaval bom é o dos banqueiros deste país. Bilhonários e rachando o bico do povo 
1378,2020-02-20,Tenho uma dúvida... mandei no pv
1379,2020-02-20,Isso me lembra da propaganda do @BancodoBrasil oferecendo financiamento de PS4 na época do lançamento do console Casa própria ou apple Mac pro? Converse com o seu gerente
1380,2020-02-20,"Agência Garavelo, Aparecida de Goiânia, Goiás."
1381,2020-02-20,"Oi, Thiago! Nosso informe de rendimentos já está disponível pelo app, internet ou terminal. A remessa pelos correios estará disponível a partir de 28/02/2020."
1382,2020-02-20,"Soja milho algodão transgênicos; gdes produtores são bem atendidos. Arroz tem cheiro de prod. químico! Raros lotes tem 1 cheiro +ameno; arroz Paris integral tem cheiro q lembra ""menta"" ""pasta de dente"". É agrotóxico, OGM transgênico? Basf? @jairbolsonaro @ernestofaraujo @SF_Moro"
1383,2020-02-20,Boa! Realmente quem sabe se um dia for sem tarifas hahsuhdauhaaha 
1384,2020-02-20,A safra está garantida.
1385,2020-02-20,"hoje, 20/02/2020 foi o primero dia que fui ao @BancodoBrasil e fui atendido rápido e de forma eficiente. por ora, me mantenho cliente."
1386,2020-02-20,"@BancodoBrasil existe alguma maneira de entrar em contato com alguem a respeito da minha conta, morando fora do país? nao acho UM email ou telefone"
1387,2020-02-20,Tentei pagar e tb n consegui
1388,2020-02-20,É o @Brunozor ?
1389,2020-02-20,662673237-49 data nas 30/09/1960
1390,2020-02-20,#CréditoRural | O @BancodoBrasil lançou hoje a linha de crédito para o pré-custeio da #Safra 2020/2021
1391,2020-02-20,#CréditoRural | O @BancodoBrasil lançou hoje a linha de crédito para o pré-custeio da #Safra 2020/2021
1392,2020-02-20,Fiquei muito feliz em saber que a minha equipe da agencia te atendeu super bem. Em qual agencia que trabalham estes anjos? E seja bem vinda ao BB 
1393,2020-02-20,"Olá, Carlos. O extrato do Pasep bem como saldo de sua cota são solicitados de forma presencial em uma agencia BB."
1394,2020-02-20,"@BancodoBrasil Sou militar da reserva, e em 2008 recebi um valor irrisório de pasep, agora o governo esta pagando o pasep do ano de 70 a 88 e preciso saber o saldo, referente a esse ano."
1395,2020-02-20,Olá. Fico feliz em saber que o atendimento desta agencia vem te satisfazendo. Tomei a liberdade de encaminhar o seu elogio para a minha equipe de Mossoró. Tenho certeza que ficarão bem feliz com a sua avaliação positiva 
1396,2020-02-20,"Tá, obrigado"
1397,2020-02-20,Grato
1398,2020-02-20,"Um belo atendimento sem nos enfiar coisas que nem sabemos ou entendemos. Obrigada @BancodoBrasil ... @itau vcs q lutem pois nunca me terão como cliente, racistas"
1399,2020-02-20,"Fui no @itau abrir uma conta, sai de lá sem saber qq eu tinha aberto, moça sem educação explicou nd, só abriu por abrir mesmo. Nunca nem desbloqueei o cartão. Hoje fui no @BancodoBrasil fui super bem atendida, td que perguntei me ajudaram, explicaram detalhe por detalhe+"
1400,2020-02-20,"Oi, Thiago! Até o final de fevereiro, o Informe de Rendimento já estará disponível pra consulta no nosso portal!"
1401,2020-02-20,"Olá, Tyago. Vc conseguiu verificar o desbloqueio na agencia?"
1402,2020-02-20,"Avante, @BancodoBrasil! "
1403,2020-02-20,"Olá, Rodrigo. Vc consegui ser atendido? Em qual telefone vc ligou?"
1404,2020-02-20, 
1405,2020-02-20,A indenização vem
1406,2020-02-20,"Olá, Fábio. Qual tipo de conta vc tentou abrir na agencia? Por gentileza, me envie o seu CPF e mais detalhes via DM para que eu tome providências com o ocorrido."
1407,2020-02-20,"Ei, Thiago! O Informe de Rendimento Anual já estará disponível no IB até o dia 28 de fevereiro, tá bem?"
1408,2020-02-20,"Olá. A liberação do celular de quem está no exterior poderá ser feita de três formas: procurador no Brasil, SMS ou envio do formulário. Por gentileza, me envie uma DM com seu CPF para eu verificar o seu caso."
1409,2020-02-20,"Olá. Vc se refere a compra em seu cartão de crédito? Vc poderá contestá-las diretamente pelo app Ourocard, selecionando a compra não reconhecida. Para eu verificar o seu caso, por gentileza, me envie uma DM com o seu CPF."
1410,2020-02-20,Parabéns @BancodoBrasil mudança na gerência da Agência 0036- 1 Mossoró RN melhorou muito já começa na triagem no acolhimento dos Clientes
1411,2020-02-20,#EsquerdaEsquizofrenica #GloboLixo #CalaABocaCatanhede #SomosTodosBolsonaro #SomosTodosGenHeleno #AcamparEmBrasilia #Dia15EuVou #Dia15PeloBrasil
1412,2020-02-20,DM respondida.
1413,2020-02-20,Tô a 20min esperando o @BancodoBrasil me atender no telefone
1414,2020-02-20,"Olá, Daniel. É só aguardar que eu te atenderei de acordo com a fila lá na DM. A cada nova interação, o meu assistente é reativado para tentar te ajudar."
1415,2020-02-20,Dá-lhe @BancodoBrasil
1416,2020-02-20,"@BancodoBrasil Não sabia que tinha horário para abertura de conta nas agências!! Estão correndo com os clientes, fui hj na Agência da cidade de Alvorada as 14:45 e fui informado que o sistema estava fora do ar mas observei todos digitando e trabalhando normalmente!! Privatiza!!"
1417,2020-02-20,"Pedi para uma amiga ir a agência e verificar se eles receberam meus emails, eles disseram que não olham emails, mas que iriam resolver no mesmo dia. Eu continuo sem acesso ao aplicativo após um mês tentando resolver. @BancodoBrasil"
1418,2020-02-20,"Liguei para a central de atendimento e me disseram que não havia nenhuma forma de contatar a agência, que eu deveria continuar mandando emails. + @BancodoBrasil"
1419,2020-02-20,"Moro no exterior, meu aplicativo funcionava para pagamentos e transferências até dezembro. Agora recebo a mensagem de que o dispositivo não está liberado. Mandei email para minha agência (0287-9) conforme o passo a passo do site, não obtive resposta.+ @BancodoBrasil"
1420,2020-02-20,@BancodoBrasil que palhaçada é essa que tem um monte de recarga de celular do RJ que eu NÃO fiz e tb tem compras que eu não fiz. ??????
1421,2020-02-20,"Opa, vou tentar o meu também então!"
1422,2020-02-20,"Olá, Thallita. Às vezes, o boleto recém emitido pode levar alguns minutos para ser registrado e reconhecido pelo app. Que bom que deu certo."
1423,2020-02-20,Obrigada. Consegui pagar!
1424,2020-02-20,"Olá, Anderson. Lamento pelo ocorrido. Por gentileza, me envie uma DM com o seu CPF e prefixo da agencia para acionamento."
1425,2020-02-20,Acho que está com problema no sistema lá de registro de boletos...
1426,2020-02-20,Acho que era sim pq agora deu certo! Fiquei na dúvida pq geralmente eu já gerava o boleto e na hora mesmo o pagamento dava certo. Muito obrigado viu? :*
1427,2020-02-20,"Não dá para ser perfeita em tudo Mesmo assim, parabéns pelo seu talento. Se um dia pensar em ter o coração azul e amarelo, é só me chamar "
1428,2020-02-20,"@BancodoBrasil Uma vergonha chegar à agência do BB em Santa Catarina, Zona Norte de Natal RN e de 25 TAA apenas 01 estar disponível para depósito."
1429,2020-02-20,É o Gmail de sempre
1430,2020-02-20,"@bancodobrasil libera R$15 bilhões para compra antecipada de insumos; “Recursos do pré-custeio permitem que produtores se planejem melhor”, afirma ministra @terezacrisMS Leia: http://www.norteagropecuario.com.br #NorteAgroTO #agronegócio #agropecuária #agricultura #custeioagrícola"
1431,2020-02-20,AGORA ME DEU MAIS CURIOSIDADE AINDA
1432,2020-02-20,AH AGORA QUERO SABER
1433,2020-02-20,Da outra vez que tentei pagar já afirmei: não sou obrigado e não terei conta no @BancodoBrasil; o que está no boleto do @detrandfoficial + uma vez era mentira. Seu funcionário não sabia o que fazer. Economizar caixas mas não implementar o auto atendimento é uma piada.
1434,2020-02-20,#Dia15PeloBrasil
1435,2020-02-20,"Olá, Anderson. Vc tem conta comigo? Vc tentou gerar a guia para pagar no guichê de caixa?"
1436,2020-02-20,"Olá, Carol. O app está normal. Qual o erro gerado? Os boletos recém emitidos demoram alguns minutos para serem aceitos devido ao registro obrigatório. Esse é o seu caso?"
1437,2020-02-20,"4h depois, finalmente consegui chegar em casa (há 10 minutos). 3h de espera até ser atendido @BancodoBrasil isso é uma chacota. Vocês sabem que tão sujeito a processo, né?"
1438,2020-02-20,Olá. Vc tem certeza que a ligação partiu do BB? Vc tem conta comigo e foi alguém de sua agencia quem ligou?
1439,2020-02-20,"E a saga pra tentar pagar imposto continua: @detrandfoficial finge que tem convênios com 3 bancos, todos estatais; veja o detalhe dos locais de pagamento. E @BancodoBrasil finge que aceita nos terminais de atendimento. Não aceita. "
1440,2020-02-20,"Poxa, João. Não fica tliste. Por favor, me envie uma DM com o seu CPF para eu verificar o se caso."
1441,2020-02-20,"@BancodoBrasil oi amor, boa tarde.... tá tendo algum problema no app? To tentando pagar um boleto mas fala q ele não é aceito (e é um boleto normal, como qqr outro q eu paguei esses dias).. =)"
1442,2020-02-20,"Olá, Marcos. 24 e 25/02/2020 – Não haverá atendimento ao público. 26/02/2020 – Início do atendimento às 12h e encerrando no horário normal de fechamento."
1443,2020-02-20,"Por gentileza, peço que me envie uma DM para eu verificar o seu caso. No app, vc pode consultar os limites personalizados na opção meus limites. Lá vc verifica o máximo diário, mensal e por canal tb."
1444,2020-02-20,@BancodoBrasil não consigo atendimento humano por DM. O robô solicita os meus dados várias vezes e não transfere.
1445,2020-02-20,Respondi sua DM. Vamos conversar por lá.
1446,2020-02-20,eu so queria q o @BancodoBrasil aumentasse o meu limite 
1447,2020-02-20,"Uso também, mas pra outras coisas só o Itau resovleu mesmo. Aka me dar um cartao de credito com limite civilizado e financiar um carro."
1448,2020-02-20,O @BancodoBrasil anunciou hoje o valor de R$15 bilhões para pré-custeio da safra agrícola 2020/2021. Os recursos estão disponíveis para todas as culturas http://bit.ly/2ueGEQQ Marília García Senlle/ISA©
1449,2020-02-20,"Eu gosto muito do Inter, mas infelizmente ele não tem agência física (apesar deu nunca ter precisado)."
1450,2020-02-20,Uma das melhores coisas que fiz ano passado foi transferir minha conta principal do Banco do Bolsonaro pro Itaú.
1451,2020-02-20,DM respondida.
1452,2020-02-20,@BancodoBrasil DM URGENTE
1453,2020-02-20,"O app do BB permite que eu preencha esses dados, mas não calcula automaticamente."
1454,2020-02-20,Estranho. No app da Caixa ele calcula automaticamente os juros/multa. O do BB não.
1455,2020-02-20,"Olá, Paulo. As regras do boleto vencido são registradas pelo emissor do boleto e nem todo boleto vencido será aceito pelo app. Mas lá vc tem um campo para fornecer o acréscimo desejado (se o boleto permitir)."
1456,2020-02-20,"Ver se tu não gastou o limite mensal, ou o diário. E também ver se teu sistema tá atualizado."
1457,2020-02-20, 
1458,2020-02-20,Poxa bb meu coração já é laranja @Bancointer
1459,2020-02-20,@BancodoBrasil vcs abrirão na segunda?
1460,2020-02-20,"Depois de quase 3h de espera, finalmente fui atendido. O banco bem que poderia oferecer umas comidinhas, estilo companhia aérea, né"
1461,2020-02-20, 
1462,2020-02-20,"@BancodoBrasil Olá, amados. Por que o app de vocês não calcula juros de boleto vencido?"
1463,2020-02-20,"Olá, Lulu. Vc está aguardando atendimento em uma agência? Me chama na DM para eu te ajudar."
1464,2020-02-20,"Olá, Respondi sua DM, vamos conversar por lá."
1465,2020-02-20,"Olá, respondi sua DM, vamos conversar por lá."
1466,2020-02-20,"I'm at @BancodoBrasil in Juiz de Fora, MG "
1467,2020-02-20,"Fico feliz em saber disso, Matheus! "
1468,2020-02-20,"Olá, Jorginho. Me chama na DM para eu verificar do que se trata esse débito e te orientar."
1469,2020-02-20,"Os limites variam de acordo com o meio pelo qual tu ultiliza para fazer. No app tem os limites máximos, tanto diários quanto mensais, descritos e para casa tipo de meio."
1470,2020-02-20,Não vi atendimento anterior aqui pelo Twitter. O atendente chegou a te explicar o que gerou a suspensão da função crédito do seu cartão?
1471,2020-02-20,"Oi, Mazulo. Vc conseguiu o atendimento desejado? <e fala em que agência vc esteve e seu CPF por DM para eu notificar os responsáveis."
1472,2020-02-20,"Que bom que eu te ajudei a vencer a aposta do litrão Vc não é um péssimo cliente, não "
1473,2020-02-20,DM respondida.
1474,2020-02-20,"Essa mensagem é falsa, envie para o abuse@bb.com.br para que seja tomada a devida providência."
1475,2020-02-20,"@BancodoBrasil vamos agilizar, daqui a pouco faz uma hora esperando para ser atendido"
1476,2020-02-20,"Oi, Alexandre. Vou verificar o que houve e te respondo na DM."
1477,2020-02-20,"Boa tarde, tem um débito em minha conta corrente que não estou lembrado de ter autorizado. Estou tentando entrar em contato com o atendimento via telefone mas não consigo. No aguardo da resposta de vocês. Obrigado."
1478,2020-02-20,"Robson, caso vc esteja com as suas linhas suspensas não haverá margem para contratação de um novo consignado. Neste caso, sugiro que faça a renegociação diretamente a débito em sua conta ou boleto. Vc pode contratá-la diretamente pelo app BB > solução de dívidas."
1479,2020-02-20,"Olá! Aguardo sua DM com o prefixo ou endereço da agência onde isso ocorreu, e tbm seu CPF."
1480,2020-02-20, 
1481,2020-02-20, @BancodoBrasil vocês são top
1482,2020-02-20,"Todo dia o mesmo Mazulo reclamando no twitter de uma empresa diferente. Hoje é a vez do @BancodoBrasil Quase 2h e meia e um total de 0 atendimentos. Faziam uns quase 3 anos desde a última vez que precisei vir, nada mudou"
1483,2020-02-20,"Banco do Brasil anuncia nesta quinta (20) o valor de R$15 bilhões para o Pré-Custeio 2020/2021, recurso 47% superior do que o destinado à safra anterior. O diretor-geral do Senar, Daniel Carrara, participou do evento. @Min_Agricultura @TerezaCrisMS @bancodobrasil "
1484,2020-02-20,Banco do Brasil não está aceitando mais pagamento para a Nuconta? Tô desde ontem tentando pagar um boleto e só dá erro. @BancodoBrasil @nubank
1485,2020-02-20,"Oi, Thiago. Me chama na DM para eu verificar seu caso."
1486,2020-02-20,"@BancodoBrasil sempre essa mesma mensagem Olá! Me manda uma DM com sua agência e conta, e me explica melhor o que aconteceu. Vergonha"
1487,2020-02-20, 
1488,2020-02-20,@BancodoBrasil vcs são uma vergonha tentei contato hoje e fui respondido automaticamente sempre a mesma resposta mudava a pergunta e o robô respondia o mesmo.
1489,2020-02-20,de nada! Qualquer dúvida é só chamar!
1490,2020-02-20,"Olá! Me manda uma DM com sua agência e conta, e me explica melhor o que aconteceu."
1491,2020-02-20,"Olá! Me manda uma DM com sua agência e conta, e me explica melhor o que aconteceu."
1492,2020-02-20,"Ficou show, Leticinha! Já é minha cliente? Chama na DM."
1493,2020-02-20,"Oi, Nyesla. A revisão de limite de crédito é automática. Posso verificar melhor na DM."
1494,2020-02-20,Olá! Me manda uma DM com sua agência e conta ou CPF pra eu verificar o ocorrido e te orientar certinho.
1495,2020-02-20,"amasso meu bolso ne, cabou com meu carnavaaaal"
1496,2020-02-20,Oi @BancodoBrasil pode mandar a minha fatura por e-mail?
1497,2020-02-20,Arte contemporânea. Inovador.
1498,2020-02-20,professora pedindo pra fazer o logo do @BancodoBrasil em 3D para treinar na aula... eu: 
1499,2020-02-20,Vixe! #shitgotreal
1500,2020-02-20,"Olá! O estrangeiro pode ter conta no BB, desde que tenha CPF e domicílio no Brasil. ;)"
1501,2020-02-20,Aguardo resposta ou terei que realizar um processo contra o banco.
1502,2020-02-20,"Olá! Manda pra mim uma DM com o prefixo ou endereço da agência que vc foi, e seu CPF pra eu registrar sua interação."
1503,2020-02-20,Sempre que venho ao @BancodoBrasil sou atendido no negocial por um senhor que me tira a paciência. No caixa sempre por uma tia que é mó limpeza. Parece que contrabalança a minh chateação.
1504,2020-02-20,Pode ser pago hoje tá :) kkkkkk
1505,2020-02-20,"Olá! Me manda uma DM com sua agência e conta, e me explica melhor o que aconteceu."
1506,2020-02-20,"Pessoal que trabalha nas redes do @BancodoBrasil , cês nem são gente! São anjos! Obrigada pelo mimo, Fernando! Eu também amo pizza! #ourocard"
1507,2020-02-20,"I'm at @BancoDoBrasil in Alfenas, MG "
1508,2020-02-20,"Rosângela, lamentamos muito o ocorrido e te recomendamos que entre em contato com a instituição financeira que emitiu o seu cartão e informe o corrido. No verso do seu cartão você encontra o telefone para contato com a Central de Atendimento. Qualquer dúvida, continuaremos aqui!"
1509,2020-02-20,"Em 2014 fiz um empréstimo, e atrasou, agora tentei renegociar a dívida , como sou servidor, quis fazer um consignado no BB , só que não aceitaram. Eu propus fazer o consignado, do total do empréstimo descontar oque devo pro banco e descontar as prestações direto em folha."
1510,2020-02-20,"Oi, João. Vc já pediu seu cartão Universitário Personalizado? Se precisar de ajuda, me chama na DM."
1511,2020-02-20,"Não é agendamento vc é o robô do BB mas te explico, quero fazer a TED do meu PASEP e não tenho conta nessa joça só que não funciona de jeito algum."
1512,2020-02-20,"Olá! Me manda uma DM com seu CPF pra eu verificar a situação da TED, se ela já foi devolvida e ver se consigo agendar uma nova transferência pra vc. ;)"
1513,2020-02-20,@BancodoBrasil Sério que respondem a todos automaticamente ainda com a mesma mensagem?
1514,2020-02-20,Não tenho conta sou correntista de outro banco e quero fazer TED do PASEP e não funciona
1515,2020-02-20,Olá! Me manda uma DM com sua agência e conta ou CPF pra eu verificar o ocorrido e te orientar certinho.
1516,2020-02-20,@BancodoBrasil gostaria de saber quando voltará a TED do PASEP moro em município que não tem BB e vou ter que sair do trabalho pra ir sacar isso é vergonhoso o serviço funcionou menos de um ano.
1517,2020-02-20,Do que adianta mandar pela DM vocês são uns robôs que respondem tudo automaticamente? Lixo de banco vou voltar pra caixa melhor que eu faço.
1518,2020-02-20,Olá! Me manda uma DM com sua agência e conta ou CPF pra eu verificar o ocorrido e te orientar certinho.
1519,2020-02-20,"Essa mensagem não é do BB, é fraude. Peço por gentileza que envie uma cópia dela para abuse@bb.com.br. É meu canal de denúncias para esse tipo de golpe."
1520,2020-02-20,"Olá! Seja bem vinda!!! Qualquer coisa que vc precisar, pode contar comigo por aqui. ;) #MaisQueDigital"
1521,2020-02-20,Não precisa ter conta para pedir um cartão de crédito no BB. ;)
1522,2020-02-20,Olá! Me manda uma DM com sua agência e conta ou CPF pra eu verificar o ocorrido e te orientar certinho.
