,date,text
0,2020-01-31,@falanext reizinho perfeito q ainda dá 20 reais pra usar o uber todo mês
1,2020-01-31,"fora que eu adoro ter 20 reais pra gastar com uber todo mês, quebra um baita galho"
2,2020-01-31,Só queria que o @falanext mandasse meu cartão
3,2020-01-31,"uso @falanext pq é o único que me aceitou pra crédito, é otimo (exceto pelo suporte, isso é podre) outra vantagem que eu acho muuuuito boa é o fato de ser do bradesco, então eu posso usar as agências, os caixas eletrônicos, etc"
4,2020-01-31,"Eu tinha a NuConta, era ótima, mas cobra o saque. Daí fui pro @falanext t e posso sacar em qualquer bradesco ou 24h. Fora que ja ganhei alguns mimos do @falanext , coisa que a NuConta nunca me deu. Continuo com o cartão de crédito do @nubank. @falanext libera um pra mim aí pffff"
5,2020-01-31,@falanext sera que da p eu usar minha conta ou ta dificil????? mais de um mes tentando E VCS não ARRUMAM
6,2020-01-31,Kkkkkkkkk por isso n confio em nenhum
7,2020-01-31,"Oie! Respondi sua DM, dá uma olhadinha."
8,2020-01-31,Como funcionam esses mimos da next?
9,2020-01-31,"A liberação do crédito está sujeito a análise. Quando ficar disponível, vamos te avisar."
10,2020-01-31,lixo
11,2020-01-31,"Oi, Bruna. Seu app está atualizado?"
12,2020-01-31,Cartão de débito/conta corrente serve também?? poxa @falanext mima eu aqui!
13,2020-01-31,Cartão @falanext é muito bom cara 
14,2020-01-31,E da Bradesco @falanext
15,2020-01-31,Desde novembro tentando receber minha segunda via do cartão do Next. Pensando muito em cancelar. @falanext
16,2020-01-31,o @falanext é tão ruim que nem encerrar minha conta eu consigo sem passar por uma puta burocracia
17,2020-01-31,"Olá! Respondi sua DM, dá uma olhadinha."
18,2020-01-31,"Olá! Pq não está conseguindo realizar compras com o cartão? Aparece alguma mensagem de erro? Se sim, envia pela DM, por favor?!"
19,2020-01-31,"Olá! Peço desculpas pela experiência, me chama na DM, por favor?"
20,2020-01-31,"Eu recebo pelo Bradesco, então já tenho uma conta salário lá, acho que já é mais fácil transformar em conta corrente.. vou ver se abro lá"
21,2020-01-31,"Oi, Guilherme. Pedimos desculpas por qualquer transtorno causado no seu atendimento. Vamos te ajudar com isso. Chama a gente pela DM, por favor?!"
22,2020-01-31,"Olá! Aparece alguma msg de erro quando acessa o app? Se sim, me manda um print na DM, por favor? O seu app está atualizado com a nossa última atualização?"
23,2020-01-31,@falanext Uma dúvida aqui. Como vocês conseguem ser o melhor banco digital?
24,2020-01-31,"Olá! Vamos te ajudar com isso. Chama a gente pela DM, por favor?!"
25,2020-01-31,Olá! Sempre que possível atualizamos o aplicativo e incluímos novos serviços e melhoramentos. Estamos estudando a possibilidade de disponibilizar outras formas para pagamento da fatura e acredito que em breve teremos novidades. 
26,2020-01-31,"simmm eu tenho no nubank, aí eu vou pegar o din e encerrar no bb"
27,2020-01-31,Eu tô ligado. Mas até hj não tive problemas.
28,2020-01-31,Depois de mais de um ano usando @nubank / @falanext eu nunca mais precisei ir em agência e passar por aqueles constrangimentos de tirar todo metal da mochila (das q não tem guarda volume)
29,2020-01-31,Faz uma conta no @falanext BB melhor coisa
30,2020-01-31,@falanext olhem a dm de vocês
31,2020-01-31,"@falanext o banco que mima você, mas tá cagando pra te atender!"
32,2020-01-31,Next = Bradesco com fachada diferente Corre disso também
33,2020-01-31,@LollapaloozaBr não rola prorrogar a entrada social mais um pouco???? To esperando entregarem o meu cartão @falanext 
34,2020-01-31,AAAAAAAAA PQ MEU CARTÃO DA DANDO CANCELADO SENDO QUE NUNCA USEI??????? @falanext
35,2020-01-31,Fui no @Bradesco cadastrar a biometria do @falanext e estragaram meu cartão novinho e ainda por cima não fez a biometria. Puta que pariu!!
36,2020-01-31,"Oi, gato! Vem cá que eu quero te usar todinho @falanext "
37,2020-01-31,@falanext q banco lixo vcs sao viu? arrependida de criar uma conta
38,2020-01-31,"@falanext E AÍ BONITAS, vamos trabalhar e ajudar o cliente aqui?"
39,2020-01-31,"Tá foda entrar em contato com vocês hein, não respondem em nenhum lugar tipo de contato, só falta eu mandar um pombo correio pra tentar resolver meu problema"
40,2020-01-31,@falanext preciso que vocês respondam o chat!
41,2020-01-31,Porra @falanext tô o dia todo tentando entrar no app e diz que tá fora do ar. Preciso pagar minhas contar querida 
42,2020-01-31,Vou de dm
43,2020-01-31,Eu nem marquei vcs e vcs me responderam Caramba
44,2020-01-31,"Muito legal ficar 25 min esperando para ser atendido pelo @falanext ... A ligação caiu, liguei novamente e estou aqui passando dos 10 min de espera ... Desisto"
45,2020-01-31,#Sóvem
46,2020-01-31,"Putz, até que enfim consegui falar com vocês.Vamos lá, eu fui roubado e comprei outro celular, quando acesso o App pelo outro celular, ele envia um código pro meu email mas eu não recebi esse código, queria saber se o meu email está cadastrado errado ou se o código não está indo"
47,2020-01-31,"Oi, tudo bem? Valeu pela sugestão!! Estamos trabalhando em melhorias para facilitar a disponibilização de valores em conta e logo mais teremos novidade, hein "
48,2020-01-31,Namoral mandem a @falanext responder minha dm
49,2020-01-31,@falanext esperando ate agr meu codigo de acesso chegar e nada ne
50,2020-01-31,o auge de hoje foi o @falanext me enviar um cartão de crédito visa platinum sem nenhum limite de crédito k 
51,2020-01-31,"Olá, tudo bem? Peço desculpas pelo ocorrido, o nosso time tá focado em melhorarias, estamos aqui para ajudar. Pode me contar o que aconteceu?"
52,2020-01-31,"já chamei, já verificaram e nada foi resolvido"
53,2020-01-31,"Sim. Eu fiz o pedido dia 21/01, hoje já é o oitavo dia útil e nada de resposta :("
54,2020-01-31,Atendimento por chat uma merda. No sac nos deixam esperando pra sempre. Não responde a DM. Tá foda ein
55,2020-01-31,@falanext amados help pois estou dentro do banco tentando sacar o dinheiroOOoOo
56,2020-01-31,@falanext vocês podem me ajudar? Meu cartão que acabou de chegar está dando cancelado
57,2020-01-31,"Oi, Léo! Em que podemos ajudar?"
58,2020-01-31,Mais um dia eu vindo reclamar da @falanext pq eles me deixam esperando ou não me atendem 
59,2020-01-31,
60,2020-01-31,Oie! Em que podemos ajudar?
61,2020-01-31,Oie! Adoraríamos tê-lo como cliente . Vc precisa esclarecer alguma dúvida sobre nossas propostas e benefícios?
62,2020-01-31,"Olá! Vc se refere a aprovação de conta? Se sim, o prazo de análise é de 03 a 07 dias úteis."
63,2020-01-31,"to me questionando isso, no aplicativo só mostra data e nome, conversei com 3 atendentes e me disseram que “possuem as mesmas informações que eu”"
64,2020-01-31,pqp é impossível encerrar conta no @falanext
65,2020-01-31,Vc não tem o comprovante? É aceito boleto bancário de qualquer banco em seu nome ou dos seus pais.
66,2020-01-31,Respondi o seu outro comentário.
67,2020-01-31,Respondi o seu outro comentário.
68,2020-01-31,Respondi o seu outro comentário.
69,2020-01-31,Respondi o seu outro comentário.
70,2020-01-31,Oi! Vc conseguiu realizar a contestação?
71,2020-01-31,"Respondi o seu outro comentário, verifique por favor."
72,2020-01-31,Oi! Respondi o seu outro comentário.
73,2020-01-31,Oi! Foi feito a contestação dos valores?
74,2020-01-31,Oi! O que aconteceu que fez vc pensar assim?
75,2020-01-31,"Mas queria um fundo conservador 100% do CDI, mesmo. De todo modo, obrigada pelo retorno."
76,2020-01-31,"Oi, Iara! Lamento muito a experiência, peço desculpas! Por favor, chama na DM, vamos verificar!"
77,2020-01-31,"Oi next meu amigo @krlsamuel não consegue acessar a conta desde que trocou de celular, ajudaaaaaaaaáaaa helpppppppppp"
78,2020-01-31,"Oie! Peço desculpas pelo transtorno! Chama na DM e informe com mais detalhes o que está acontecendo, por favor."
79,2020-01-31,@falanext por que me decepciona tanto?
80,2020-01-31,Chegou meu cartão @falanext 
81,2020-01-31,"@falanext ajuda eu aqui a liberar a minha conta logo pra eu usar meu cartão pfvr nunca te pedi nada, só queria sextar"
82,2020-01-31,Respondi o seu outro comentário.
83,2020-01-31,"Oie! Peço desculpas pelo transtorno no atendimento, estamos trabalhando em melhorias. Em que podemos ajudar?"
84,2020-01-31,"Oi, peço desculpas pelo ocorrido. Já respondemos sua DM, me conta o que aconteceu por lá!"
85,2020-01-31,"Oie! Peço desculpas pelo transtorno no atendimento, estamos trabalhando em melhorias. Em que podemos ajudar?"
86,2020-01-31,"Deve ser porque eu recebo meu salário lá, aí o @falanext ficou tipo “amada?”"
87,2020-01-31,"Oi, Lucas! Peço desculpas pelo incômodo! Vamos verificar, chama na DM por favor."
88,2020-01-31,O nome da pessoa que está fazendo cadastro e tentando abrir conta nos dois bancos @nubank e @falanext é com meu e-mail é Karen Hellen dos Santos Costa.
89,2020-01-31,"“Termos do serviço” ao tentar adicionar o cartão do @falanext no Apple Pay O do @timeneon também aparecia algo assim, essa demora por novos bancos/emissores já passou do limite."
90,2020-01-31,Já respondi lá!
91,2020-01-31,Oie! O que aconteceu que fez vc pensar assim?
92,2020-01-31,A ideia é perder o dinheiro ali no meio mesmo Aí um dia do nada eu vô vê e tem 10 conto dando mole hahah É tipo achar dinheiro no bolso da calça kkk
93,2020-01-31,Tentei entrar em contato com o banco @falanext mas só clientes podem falar com atendente. Recebi um e-mail dizendo que uma pessoa está abrindo uma conta usando meu e-mail. Como proceder? Recebi o mesmo e-mail com o nome da mesma pessoa pelo @nubank nubank onde já tenho conta.
94,2020-01-31,jkkkkkkkk
95,2020-01-31,"Olá! Apresentou alguma mensagem? Se sim, envia na DM, por gentileza."
96,2020-01-31,"Si, huye a México. kkkkk. Broma"
97,2020-01-31,A conta onde você recebe seu pagamento atualmente é uma conta salário ou conta fácil (corrente/poupança)? Perguntamos pois só é possível o pedido de portabilidade de contas salário.
98,2020-01-31,Se eu usar esse tanto de banco eu nunca mais acho meu dinheiro na vida kkkkkkkkkkk
99,2020-01-31,Crendeuspai
100,2020-01-31,"Oi, tudo bem com vc? Poxa, o que aconteceu? Vc pode me explicar por DM, se preferir!"
101,2020-01-31,No next eu não consegui crédito 
102,2020-01-31,@falanext vcs podem me ajudar???
103,2020-01-31,"Então.. tempos atrás eu criei uma conta do @falanext . Chegaram dois cartões aqui em casa que eu não consegui desbloquear. Tentei falar com eles, mas sem sucesso."
104,2020-01-31,"Alô, @falanext, estou com vocês há muuuuito tempo, até migrei minha conta salário, pago tudo em dia e adiantado, gosto muito do banco, mas não to entendendo a dificuldade em me liberar um cartão de crédito sendo que outros bancos já fizeram propostas... +"
105,2020-01-31,"Olá! Somos um banco 100% digital, sem tarifas e com transações ilimitadas (Cesta next), como: Saques, Transferências e TED/DOC, além de contar com ""Mimos"" exclusivos. Para mais informações, acesse:"
106,2020-01-31,aqui é @digio e @bancodobrasil irmão!
107,2020-01-31,"Eu uso Nubank, Next e BB (pq eu recebo do governo pelo BB)"
108,2020-01-31,"Oi, tudo bem? Tudo depende do investimento que vc fizer e o valor aplicado, os nossos investimentos estão buscando superar o CDI. O Fundo Alocação Arrojada, por exemplo, chegou até 188,79% do CDI no mês de dezembro."
109,2020-01-31,Eu uso ambos hehe
110,2020-01-31,Quer um convite do @falanext ?
111,2020-01-31,chamei lá
112,2020-01-31,"Você não entendeu? eu já disse que esses 15 dias úteis já passou, eu estou esperando a mais de 70 dias"
113,2020-01-31,"Foi realizado o reenvio do cartão, então o prazo é de até 15 dias úteis a partir da data de reenvio."
114,2020-01-31,@falanext pelo amor de deus eu só quero que entreguem meu cartão nem é pedir muito
115,2020-01-31,Respondido de volta.
116,2020-01-31,"Tenho orgulho de dizer que tenho conta corrente no banco @falanext,que pertence ao @Bradesco !!! @badgallore abre uma conta no @Bradesco , tira todo seu dinheiro do banco racista e preconceituoso que se chama @itau !!! Banco racista e preconceituoso!! "
117,2020-01-31,Usa o @falanext os benefícios são ótimos
118,2020-01-31,"Olá! Respondi sua DM, vamos prosseguir com o atendimento por lá. Dá uma olhadinha."
119,2020-01-31,Alô @Bancointer @nubank @falanext @C6Bank
120,2020-01-31,Já estamos trabalhando para disponibilizar essa opção e em breve clientes next também poderão usar o depósito imediato.
121,2020-01-31,"Oie! Poxa, a liberação está sujeita a análise de perfil, mas me chama na DM, por gentileza? Vamos auxiliar vc."
122,2020-01-31,Alô @Bancointer @falanext @nubank @C6Bank
123,2020-01-31,obrigado @falanext por ser um ótimo banco e não ser racista !! 
124,2020-01-31,"Vou fechar minha conta no @itau, qual banco vcs recomendam? @Bradesco? @nubank? @BancodoBrasil? @timeneon? @falanext?"
125,2020-01-31,Chamei
126,2020-01-31,"Eae @falanext sou cliente de vocês há 2 anos e até hoje não me liberaram crédito, me ajuda aí "
127,2020-01-31,Olá! Estamos trabalhando nisso e em breve teremos novidades!
128,2020-01-31, 
129,2020-01-31,"Olá! Vou pedir para a nossa equipe responsável te ajudar! Me chama na DM, por favor?"
130,2020-01-31,"Olá! Por favor, entre em contato com o chat. Me avise se vc conseguiu."
131,2020-01-31,"Opa! Vamos verificar isso pra vc. Chama na DM, por favor."
132,2020-01-31,Ja informei varias vezes só ver o DM
133,2020-01-31,"Olá! Você precisa informar o assunto ou informação que vc precisa no chat (App), assim a BIA (inteligência artificial) pode direcionar o seu atendimento para um especialista."
134,2020-01-31,"pois é meu caro, não abra conta nesse banco!!!!"
135,2020-01-31,"Entendemos, sim. Para realizar a regularização do token, é necessário entrar em contato com a central para que eles te auxiliem: 0800 275 6398"
136,2020-01-31,Pqp
137,2020-01-31, 
138,2020-01-31,Olá! Vc entrou em contato com o chat? Qual orientação vc recebeu?
139,2020-01-31,"Oi, tudo bem? Poxa, não se sinta assim! Quando completar 18 anos vc poderá mandar sua proposta para abrir a conta! :)"
140,2020-01-31,@falanext faz mais de um mês que meu cartão se encontra “em trânsito” e eu simplesmente não consigo entrar em contato com vcs porque o chat é péssimo. pelo amor de deus.
141,2020-01-31,"Respondi sua DM, dá uma olhadinha."
142,2020-01-31,Não.... Como posso fazer isso ? Atualizar para o cartão de crédito ?.
143,2020-01-31,e o @falanext que bloqueou a minha conta sem motivo e eu estou esperando há mais de 40 minutos pra atendimento!!!!!!!!!!!! 
144,2020-01-31,Oi tudo bem? Você tem cartão de crédito disponível? Perguntamos pois essa função fica ativa apenas para clientes com limite liberado :)
145,2020-01-31,"Vc pode me contar o que aconteceu por DM, se preferir."
146,2020-01-31,"Galera do next, seria muito bom sé vocês colocasem a opção de gerar boletos pelo app, podendo mandar para o e-mail, debito automatico é legal mas nem sempre só falta isso pra ficar perfeito"
147,2020-01-31,Ai Fode mano ...
148,2020-01-31,"Olá, seu caso está sendo verificado pela equipe responsável e assim que possível entraremos em contato novamente."
149,2020-01-31,"Oi, Davi! Estamos trabalhando em melhorias e em breve teremos novidades! Obrigado pelo feedback!"
150,2020-01-31,Alô @falanext Tô com um problema pra acessar minha conta no App e o sac de vocês enrola mais que o presidente da Cedae falando sobre a água.
151,2020-01-31,@falanext preciso de um help
152,2020-01-31,"Vc pode me chamar na DM, pf?"
153,2020-01-31,Curtindo a atualização do app do @falanext 
154,2020-01-31,"Não, pudiam ter..."
155,2020-01-31,Já respondi vcs lá 
156,2020-01-31,"Gente se um dia vocês tiverem a intenção de fazer o uso desses bancos digitais, @falanext não é a melhor opção. O atendimento pelo chat não acontece, e em nenhum outro meio de ""comunicação"" que a empresa oferece."
157,2020-01-31,"Como eu acho q eu não expliquei direito, eu tava com a parte de token aberto e quando digitava no caixa dava erro msm trocando o numero do token"
158,2020-01-31,Obrigado!
159,2020-01-31, 
160,2020-01-31,Me passa sua conta que vou depositar uma boa grana para você 
161,2020-01-31,"Ei Inter, tentei cadastrar mas não ganhei crédito. @falanext segue na frente :)"
162,2020-01-31,"Acho que o @Bradesco e o @falanext não gostam de mim. Toda vez que tento ser cliente deles, nunca me respondem. Frustrada."
163,2020-01-31,"como diria o cê zoi, banco da disgraça"
164,2020-01-31,pq atender os cara n são mt bom nisso mas a música é foda boa @falanext
165,2020-01-31,Agora é só criar um Objetivo no app para conseguir juntar uma grana para ir pro Lolla! 
166,2020-01-31,Gostaria que o aplicativo fosse atualizado de mais rápida e o valor da fatura estivesse disponível pra pagamento a qualquer momento e não ficar ligando na central de atendimento pra pedir antecipação da fatura
167,2020-01-31,meu cartão do @falanext chegoooouuuu agora só falta colocar dinheiro nele kkkkkkkk
168,2020-01-31,Olha que palhaçada esse @falanext 
169,2020-01-31,"Oiê! Respondemos sua DM, da uma olhadinha lá, por favor."
170,2020-01-31,"Vc pode me chamar pela DM, pf?"
171,2020-01-31,@falanext banco incompetente
172,2020-01-31,"mano, antes fosse, fiz porque na época precisava, banquinho filho duma puta viu !"
173,2020-01-31,Fez a conta só por conta do FREEFIRE né hahaha
174,2020-01-31,"que inferno viu amigo, eu tô quase pagando a última conta e quebrando/cancelando esse cartão, sinceramente"
175,2020-01-31,@falanext lixo lixo lixo
176,2020-01-31,@falanext lixo lixo lixo lixo lixo lixo
177,2020-01-31,nem a porra do endereco eles me passam...
178,2020-01-31,"meu cartão foi fraudado mano, compra na netflix dia 28, eu nem uso cartão mais, vai tomar no cu !! banco lixo do caralho!!"
179,2020-01-31,Devido a um comprovante de endereço que eu não consigo enviar
180,2020-01-31,"no amigo, sem condições nenhuma, lixo, lixo, lixo, não aguento mais esse app horrível, nunca funciona, um inferno pra conseguir falar na central, não consegue resolver nada, nó"
181,2020-01-31,"Oi, tudo bem? O que houve que sua conta foi bloqueada? Você já chamou a gente na opção ""Ajuda"" do app para verificar os procedimentos de desbloqueio?"
182,2020-01-31,"Nesse caso entre em contato na central de relacionamento no telefone 0800 275 6398 para verificarem, por favor."
183,2020-01-31,@falanext pior banco da face da terra
184,2020-01-31,banco filho da puta ! @falanext
185,2020-01-31,"Me ajuda vai. O @falanext já viu que meu nome tá limpo e já me deu crédito, fala Nubank cadê tua voz?"
186,2020-01-31,Esperando o @falanext a quase 2 meses resolver meu problema no aplicativo e até então estou sem acesso a minha conta e com conta atrasada! Next não conte comigo pra nada
187,2020-01-31,"Alô galera do @falanext vocês estão de parabéns! Conseguiram mais uma vez não resolver meu problema pela 4a vez. Sempre com mesma ""solução"" que sempre me leva à estaca zero. Finalmente conseguiram, migrarei para outro banco virtual "
188,2020-01-31,"meu cartão next foi possivelmente fraudado, e o @falanext simplesmente não pode me passar informações da compra que NAO EFETUEI, estão de parabéns !!"
189,2020-01-31,Cada mimo tem suas condições específicas que ficam todas disponíveis para consulta na aba do app :) Já o mimo do Cinemark não é cumulativo com meia entrada de estudante.
190,2020-01-31,desconheço banco pior do que o @falanext !!!!
191,2020-01-31,"Por favor, pode nos chamar na DM?"
192,2020-01-31,"Vcs dizem que o CNPJ da minha empresa está errado pra portabilidade do meu salário, mas já verifiquei e está correto. Mesmo assim continua sendo negado. O que posso fazer?"
193,2020-01-31,@falanext pq demora tanto p aprovar ou não um cartão??? mds
194,2020-01-31,"Olá! Poxa, pedimos desculpas pela sua experiência ruim conosco! Como podemos te ajudar?"
195,2020-01-31,Esqueirinhoooo
196,2020-01-31,Mano o cartão da @falanext é uma merda pqp! Parabéns @nubank por ser a melhor!!!!
197,2020-01-31,"Oi! Tudo bem? Envie uma DM, vou verificar. ;)"
198,2020-01-31,Fique atento em nossas novidades. ;)
199,2020-01-31,Não saquei. Eles têm rendimento automático de 100% do CDI?
200,2020-01-31,Quais os beneficios do Next? Não tem nada no site.
201,2020-01-31,Mas o prazo do envio do cartão é para 15 dias e você não acha que esse prazo já foi superado inúmeras vezes???
202,2020-01-31,"Oi, Vanessa! Respondemos seu outro comentário, da uma olhadinha lá, por favor."
203,2020-01-31,"Olá, Vanessa! Nosso time falou com você sobre o reenvio do cartão, na última semana, correto? Nesse caso, é necessário aguardar o prazo de envio do cartão. Ou tem alguma outra situação em que podemos ajudar?"
204,2020-01-31,Sim. A situação foi resolvida. Liberem o saque imediato para clientes Next! 
205,2020-01-31,clonaram meu cartão puta que pariu o que eu faço @falanext
206,2020-01-31,"Olá, Silvio! Vc verificou a Gerente da agência?"
207,2020-01-31,Olá! São feitas análises periodicamente e automaticamente onde sendo aprovado vc será notificado.
208,2020-01-31,@falanext nada da parceria com o outback voltar???? poxa indiquei a next pra tenta gente falando do outback
209,2020-01-31,@falanext me liberara um crédito aí
210,2020-01-31,"O next tem tudo para ser o melhor, não só por ter saque gratuito mais o avanço deles tem sido incrível. Atualizarão o app e eles agora estão operando 100% grátis com a Cesta Next.Isso tudo é muito bom mais eles tem muito a melhorar com o atendimento e liberação de crédito."
211,2020-01-31,Olá! Vc se refere ao DOC? Caso sim o valor é debitado no dia útil e creditado no dia útil seguinte.
212,2020-01-31,"Chama a gente na DM, por gentileza."
213,2020-01-31,@falanext 
214,2020-01-31,"Peço sinceras desculpas pelo ocorrido, te respondi no inbox."
215,2020-01-31,"Olá! O que está acontecendo? Me manda o print na DM, por favor."
216,2020-01-31,Olá! Posso te ajudar?
217,2020-01-31,"Olá, Moises! Vc entrou em contato com a sua agência conforme a orientação passada anteriormente?"
218,2020-01-31,"Olá! Pedimos desculpas pelo transtorno causado, como podemos te ajudar?"
219,2020-01-31,Dei block na senha do @falanext já pedi trocentos códigos pelo app e até agora NADA. Ajuda ai Next
220,2020-01-31,"Olá! Te respondi na DM, olha lá, por favor."
221,2020-01-31,"Chacota q eu queria abrir logo minha conta no banco, mas o @Bancointer não tá concluindo minha abertura e vcs não me aceitam. Me sentindo excluído "
222,2020-01-31,"Olá, boa noite! Poxa, ainda não temos previsão de quando a conta para menor de idade estará disponível."
223,2020-01-31,No meu não aparece essa opção porq ?
224,2020-01-31,Alguém aqui usa o @falanext?
225,2020-01-31,"Sonho, pq eu não tenho é o dinheiro pra fazer o depósito kkkkkkkkkkk"
226,2020-01-31,Olá! O que houve? Como posso ajudar?
227,2020-01-31,"Outra coisa, vcs pretendem lançar um cartão black com um programa de pontos igual ao átomos do @C6Bank A concorrência ta ganhando "
228,2020-01-31,"Que bom! Imagina, de nada. "
229,2020-01-31,"Olá! Em breve teremos novidades, fica de olho nas atualizações do app."
230,2020-01-31,Olá! O que houve? Posso te ajudar?
231,2020-01-31,"Olá! O que acontece quando vc tenta logar no app? Me envia um print na DM, por favor."
232,2020-01-31,"Olá! Ainda não foi debitado? Pq essa ação pode ser feita diretamente pelo app, é só acessar a opção ""Visão Geral"" e clicar no ícone da ampulheta, se a transação estiver agendada o app habilitará a opção cancelamento."
233,2020-01-31,Esse banco de merda que não gera fatura
234,2020-01-31,"O @falanext dá de relho no @nubank (como se diz aqui no sul). Fiz primeiro conta no next e depois no nubank porque diziam que era maravilhoso e talz. Eu tava pensando em migrar tudo, até minha conta salário, bastou um mês de nubank pra eu desistir dessa ideia."
235,2020-01-31,"Olá! Você chamou no chat (App) na opção ""Ajuda""? Se sim, envia um print do contato realizado na DM, por gentileza?"
236,2020-01-31,"Não obrigado. Já cancelei a conta, que por sinal me fez querer sair de vez do Bradesco e cancelar também minha a exclusive. @nubank você podia me dar o limite de crédito que eu tenho lá pra transferir minha grana de vez."
237,2020-01-31,Olá! O que aconteceu? Posso ajudar?
238,2020-01-31,Ja me estressando com o @falanext
239,2020-01-31,"irmão, se tu tem mais de 18y abre uma conta no @falanext sério igual lá tu não acha não"
240,2020-01-30,Isso aí! Quem sabe a gente te surpreende? 
241,2020-01-30,Deu certo!!!!!!!!! obrigado <3
242,2020-01-30,Respondi lá ;)
243,2020-01-30,Enviei!
244,2020-01-30,"Me envia o print de como aparece o seu limite via DM, pfv?"
245,2020-01-30,Só vem! #FazAcontecer
246,2020-01-30,@sooyoungchoiz Oie! É possível comprar online na função débito em sites que tenham a plataforma Verified by Visa.
247,2020-01-30,"Olá! Nos desculpe por isso. Te respondi no outro tweet, olha lá, por favor."
248,2020-01-30,"Olá! Por favor, limpa o cache e dados do seu app, depois reinstala ele, aí me diz se dá certo? Aguardo sua resposta."
249,2020-01-30,Racistas não passaram! Vou já abrir uma conta no @falanext
250,2020-01-30,Agora eu tenho um @falanext e vou ganhar desconto de ingressos no @LollapaloozaBr Mas tá faltando só uma coisa: Ter dinheiro.
251,2020-01-30,"Se for abrir pra crédito, recomendo muito não."
252,2020-01-30,Olá! Poxa! O que aconteceu?
253,2020-01-30,"eu ja liguei diversas vezes e eles dizem q o meu problema só pode ser resolvido pelo chat, pq eles n tem total acesso a minha conta"
254,2020-01-30,@falanext !! Parabéns!!!! Duas semanas com meu dinheiro na conta sem vcs resolverem nada! A incompetência de vocês merece meus parabéns.
