,date,text
2947,2020-01-15,"chamaram sim, espero que consigam resolver"
2948,2020-01-15,"Olá, vc conseguiu resolver o que precisava no chat? Qualquer coisa, chama DM para que eu possa te auxiliar."
2949,2020-01-15,Nem eu! Trava tudo!
2950,2020-01-15,Olá! Seja bem-vinda ao time! Vc tem alguma dúvida sobre sua conta next? Qualquer coisa chama na DM.
2951,2020-01-15,Olá! Como podemos te ajudar?
2952,2020-01-15,essa é a opção de crédito
2953,2020-01-15,este é o erro quando acesso a opção do gpay no app do next
2954,2020-01-15,"Olá, é uma boa ideia! Quem sabe futuramente..."
2955,2020-01-15,@falanext dnv olha a dm
2956,2020-01-15,"Oi! O prazo de aprovação é de 3 até 7 dias úteis, após finalizar o preenchimento da proposta. Quando vc finalizou a sua?"
2957,2020-01-15,Oi! Ficamos felizes em saber que tá curtindo! 
2958,2020-01-15,"Oie, tudo bem? Sua conta já voltou ao normal? Tem atualização disponível, hein! "
2959,2020-01-15,"fala @falanext bom dia, cara. deixa eu te falar uma coisa. eu estou pensando aqui, sei que está difícil pra vocês aí arrumarem em recursos, sei que está correndo atrás, mas estou falando por mim, não falei com ninguém. vê se você não consegue pelo menos aumentar 60% do meu limite"
2960,2020-01-15,"Oie! Obrigado pelo feedback, ficamos felizes em saber que tá curtindo! "
2961,2020-01-15,Responde na dm de novo pelo amor de Deus
2962,2020-01-15,Sai dae cocô
2963,2020-01-15,"Oie, tudo bem? Poxa, não conseguimos te enviar um gatinho, mas pode avisar seu tio que ""Mimos"" não vão faltar, olha só: http://spr.ly/60111j9kf "
2964,2020-01-15,"Meu cartão do @falanext chegou voando, único defeito é que não liberaram a função crédito "
2965,2020-01-15,Por nada <3! Chama eles na DM haha Acho que se ofereceram aí né? <3
2966,2020-01-15,"Opa! Anotadíssimo, valeu! "
2967,2020-01-15,"Valeu pela dica, Jonatas! O cartão virtual é indicado para realizar uma compra online apenas."
2968,2020-01-15,Banco Next @falanext amei o novo menu do app! 
2969,2020-01-15,EU to a uns 5 meses também com o @falanext e nada de aumentar meu limite tbm
2970,2020-01-15,"Olá, que bom que vc curtiu a nova versão do app! E ainda tem muita melhoria e novidade vindo por aí. Fica de olho! "
2971,2020-01-15,Fala @falanext me da limite ai 
2972,2020-01-15,"vou tentar, obrigado pela ajuda "
2973,2020-01-15,Sempre penso com carinho em todas as sugestões. 
2974,2020-01-15,"Oi, tudo bem? Vc possui a função crédito do cartão ativa? Se sim, vc pode me mandar um print da opção ""Crédito"", pf? Aparece algum erro quando vc tenta utilizar o serviço?"
2975,2020-01-15,Que bom que gostou! 
2976,2020-01-15, 
2977,2020-01-15,Que estranho! Depois tenta descadastrar e recadastrar de novo e vê se dá!
2978,2020-01-15,"Oi, tudo bem? Como podemos ajudar? Se preferir, me conta o que aconteceu por DM!"
2979,2020-01-15,"Oie, tudo bem? Vou te ajudar com isso, me chama por DM, pf!"
2980,2020-01-15,"Oi, tudo bem? Vc pode me chamar por DM, pf?"
2981,2020-01-15,"Precisamos que vc chame por DM para passarmos as orientações necessárias. Eu irei acompanhar o seu caso, estou aguardando."
2982,2020-01-15,oi @falanext será que poderiam confirmar a abertura da minha conta 
2983,2020-01-15,poxa :/ espero que eu consiga resolver.
2984,2020-01-15,"com itaucard, credicard, etc, funciona normalmente."
2985,2020-01-15,"Vamos encaminhar o seu feedback para a nossa equipe, Lucas ;)"
2986,2020-01-15,"primeiro pede pra aproximar, daí eu aproximo e espero, depois de alguns segundos a maquineta pede pra inserir o cartão. Algumas vezes já chegou a aparecer uma mensagem de erro do próprio google pay do celular, mas isso só acontece com o next."
2987,2020-01-15,@falanext quando vai liberar o crédito para mim???!
2988,2020-01-15,"@falanext mas de uma hora no telefone e so ficam transferindo, e ninguem resolve o meu problema, #faltaderespeito"
2989,2020-01-15,Oi! Peço desculpas pelo transtorno no atendimento! O que aconteceu que quer cancelar?
2990,2020-01-15,"Ela pede pra inserir, passar ou aproximar? Depois dá erro e muda pra passe ou insira? É, aparentemente, a função tá indisponível no app do next agora..."
2991,2020-01-15,Eu preciso que seja da next porque é a única que o meu chefe consegue transferir o dinheiro
2992,2020-01-15,"Então, sempre que eu tento contato pelo chat da problema ou demora e encerram meu atendimento. Só consegui ontem após ligar e na terceira tentativa. É complicsdo ter que ligar sempre pra conseguir resolver as coisas"
2993,2020-01-15,"Oi! Vamos ajudar, chama na DM por favor."
2994,2020-01-15,Alô @falanext 
2995,2020-01-15,Adorei o nome menu do @falanext 
2996,2020-01-15,"Chamei o suporte da @falanext ontem a noite e até agora não resolveram meu problema, muito bom"
2997,2020-01-15,"Na maquineta geralmente só pede para inserir o cartão, é como se não reconhecesse, algumas vezes aparece aviso de erro tb. Aparece isso aqui no next, eu lembro de ter feito uma verificação pelo app uma vez, o cartão ficou disponível no Google Pay, mas não faz os pagamentos."
2998,2020-01-15,"Sim! Consigo comprar por aproximação! Você sabe qual erro a maquininha mostra? Dentro do seu app, olha a opção Cartão, depois Google Pay. Vê se aparece que tá tudo ok... (Agora acho que tá com alguma instabilidade, mas quando voltar, vê se tá aparecendo o cartão como cadastrado)"
2999,2020-01-15,"Me chama na DM, pfv, vou te ajudar por lá."
3000,2020-01-15,"Olá! Consegui sim. Tu paga por aproximação normalmente? Aqui eu só consigo fazer compras online, quando pago por aproximação dá algum erro :/"
3001,2020-01-15,"Oi, tudo bem? Peço desculpas pelo ocorrido. Já respondemos sua DM, confere lá!"
3002,2020-01-15,"Oi @chainedtoavril, mas você conseguiu cadastrar o cartão com sucesso? Aqui ele funciona normal pra mim... :O"
3003,2020-01-15,@falanext sem dúvida o pior atendimento que se pode ter. 01h15min aguardando para não resolverem o problema. Parabéns 
3004,2020-01-15,da pra por aparelho pagando isso? quero endireitar os dentes só
3005,2020-01-15,Onde vejo a lista de clínicas/dentistas que aceitam o plano?
3006,2020-01-15,"Oi! A conta next pode ser movimentada gratuitamente se vc optar pela ""cesta next"". Qual era a sua cesta de serviços? Iremos passar as orientações por DM! Confere lá!"
3007,2020-01-15,@falanext vlw next pela falsa esperança 
3008,2020-01-15,"Seu iPhone / Android tá setado para o Brasil? Se sim, você tem que mudar na sua conta o endereço para Itália. Ou se você estiver no Brasil agora, tenta usar uma VPN com servidor na Itália."
3009,2020-01-15,"eu tenho o n26, monese e revolut. Quero ver o bunq. Mas não ta aparecendo pra mim em meu celular."
3010,2020-01-15,"Opção não falta por ai :-) Hype, bunq, N26, Tomorrow, Monese, Revolut, TransferWise, Ferratum, boon... Todos com conta gratuíta e premium. Escolhe 2 ou 3 e manda ver."
3011,2020-01-15,Boa tarde @Bradesco e @falanext só uma sugestão poderia fazer depósito estantanio no next também como e feito nas contas Bradesco E o app poderia notificar quando entra dinheiro na conta também
3012,2020-01-15,"fala @falanext, bom dia, cara. deixa eu te falar uma coisa. eu estou pensando aqui, sei q está difícil pra vcs aí arrumarem em recursos, sei q está correndo atrás, mas estou falando por mim. vê se vc n consegue liberar meu cartão de crédito aí, preciso fazer o sócio do @Cruzeiro"
3013,2020-01-15,Me responde no chat
3014,2020-01-15,"Na Itália, qual é o seu banco principal?"
3015,2020-01-15,Eu moro na Italia.
3016,2020-01-15,"Já não sou cliente do @falanext há meses, mas parece que sentem falta do meu dinheiro, porque não param de mandar email."
3017,2020-01-15,Aguardando esta funcionalidade !! É pra ontem !!
3018,2020-01-15,"@falanext, bom dia, cara. deixa eu te falar uma coisa. eu estou pensando aqui, sei que está difícil pra vocês aí arrumarem em recursos, sei que está correndo atrás, mas estou falando por mim, não falei com ninguém. vê se você não consegue pelo menos aumentar 60% do meu limite"
3019,2020-01-15,"Esse banco é um lixo!!!! Não desbloqueia meu dinheiro logo, meus boletos precisam ser pagos amados"
3020,2020-01-15,"o novo app do @falanext ficou perfeito, eu detestava o anterior."
3021,2020-01-15,podiam vender o bradesco saude com desconto pra clientes.
3022,2020-01-15,Primeiro o app ficou topppp #next Segundo o plano funciona no estado de Alagoas @falanext ?
3023,2020-01-15,"Chegou o novo Seguro Odonto do next, o plano dentário de alta cobertura pra garantir aquele sorriso lindo. Contrate direto pelo nosso app a partir de R$45,60/mês. Só vem."
3024,2020-01-15,@falanext atualizou e tá tão fofinho 
3025,2020-01-15,Quando vai ter outro mimo hour
3026,2020-01-15,"Rafael, vc não estava recebendo as notificações de compra do cartão de débito/crédito é isso? Vc pode verificar nas configurações do celular se a opção ""Notificações"" do app no next está ativada."
3027,2020-01-15,@falanext socorro não consigo acessar o aplicativoooooo
3028,2020-01-15,"Pedimos desculpas pela experiência ruim que teve conosco! Qual o problema com o débito automático? Se quiser, pode nos chamar por DM."
3029,2020-01-15,"Olá! Estamos com muitos projetos e várias ideias para disponibilizar novos serviços e funcionalidades. Por favor, aguarde as próximas atualizações."
3030,2020-01-15,"Cada caso é um caso :-) Se você mora fora, de boa, mas se morar no Brasil pode ter problemas com o N26 e outros bancos. Muita gente já teve conta cancelada por não morar na EU mas ter o endereço setado aqui. Neste caso acho que o Revolut é mais de boa."
3031,2020-01-15,"O problema é que eu já fiz estou passando muita muita muita raiva, o next consegue me estressar todos os dias"
3032,2020-01-15,"Estou nessa também, a meses que estou tentando resolver um problema e ainda não consegui"
3033,2020-01-15,"Escolha o banco next porque achei que era bom, mas pelo visto não é, um banco que não consegue resolver um problema por mais de 50 dias, não é bom."
3034,2020-01-15,"Oi, tudo bem? Já disponibilizamos um cartão virtual que vc pode usar para substituir o de crédito por até 24horas. Obrigado pela dica, aguarde as próximas novidades!"
3035,2020-01-15,"E além disso o chat descolado do @falanext não funciona. Caraca, inviável falar com vocês"
3036,2020-01-15,"O app em vez de melhorar piorou, o atendimento por lá, pelo e-mail e pelo WhatsApp de vocês não presta de maneira nenhuma, estou tentando resolver um problema desde o dia 26 de novembro e até agora não consegui"
3037,2020-01-15,"Olha @nubank eu amo vocês ... mas não dá pra viver só com R$400,00 Atualmente quem mantém minha vida de burguesa é o @falanext @itau @Bancointer @BancodoBrasil ... Me ajuda a ser livre de tarifas poxa! (Nada pessoal @Bancointer )"
3038,2020-01-15,"Visualmente ficou bom mas a funcionalidade de comprovante ficou MUITO PIOR. Não consigo mais enviar comprovante por outros métodos, só por e-mail ( que no meu caso não chegou)!"
3039,2020-01-15,Se não for pedir muito me responde no inbox por favor e resolve meu problema...
3040,2020-01-15,Poderia me dar uma atenção no chat ???
3041,2020-01-15,"Olá! Ficamos contentes em saber que vc gostou do novo visu! Ah, e o Apple Pay já está em nossa radar para as próximas atualizações."
3042,2020-01-15,"Olá! Estamos trabalhando para trazer mais melhorias, que bom que ta curtindo! "
3043,2020-01-15,"Quando eu tava empregado o @falanext ficava me jogando de um lugar pra outro quando eu tentava renegociar, agora que tô desempregada em Cristo eles mandam até mensageeeeeem"
3044,2020-01-15,Solta nois @falanext !!!!!!!! Mais de uma hora com o app indisponível! 
3045,2020-01-15,"Oi, tudo bem? Ficamos felizes em saber que curtiu! "
3046,2020-01-15,Cansei de correr atrás de quem não me quer! Adeus @nubank Olá @falanext 
3047,2020-01-15,Caraca @falanext vocês não tem um canal centralizado pra resolver coisa de conta corrente? Meu Deus do céu.
3048,2020-01-15,"eu tenho a função crédito e não consigo usar, só dá problema com o cartão de vocês"
3049,2020-01-15,"Oi, tudo bem? O nosso time tá trabalhando em melhorias e em breve teremos novidades. Por enquanto, a gente só consegue pagar os débitos do seu veículo se você tiver o código de barras em mãos, ou seja, não dá pra pagar apenas com o número do Renavam."
3050,2020-01-15,"Olá, tudo bem?Já possível usar a função crédito do cartão next no Google Pay."
3051,2020-01-15,"Depois de 40 minutos em espera, sim."
3052,2020-01-15,Já respondemos com algumas orientações! =)
3053,2020-01-15,"PORRA @falanext QUERO SABER SE TEM DINHEIRO NA MINHA CONTA E O APP TA EM MANUTENÇÃO DESDE ONTEM, ME AJUDA A TE AJUDAR, CARA"
3054,2020-01-15,"E o aumento do limite do cartão de crédito dos clientes ? No grupo do Facebook com mais de 4.000 pessoas ninguém nunca conseguiu aumento, o que vcs tem a dizer sobre isso ?"
3055,2020-01-15,Cadê o mimo next ?
3056,2020-01-15,Nada do meu cartão chegar. Meu código de rastreio não atualiza. Não aguento mais esperar esse cartão. Pensando seriamente em cancelar.
3057,2020-01-15,"Roney, ainda não temos previsão para esse serviço, tá bem? Continue nos acompanhando por aqui para ficar por dentro de todas as novidades ;)"
3058,2020-01-15,Ficou demais! Quero conta pra MEI :(
3059,2020-01-15,o design e layout do app do next depois da att ficou muito maassaaaaa parabéns @falanext 
3060,2020-01-15,Oi! Respondemos seu outro tweet com orientações.
3061,2020-01-15,Oi! Lamento pelo transtorno. Estamos trabalhando para otimizar todos os nossos canais de atendimento. Envia uma DM que vamos te ajudar com o cancelamento do cartão.
3062,2020-01-15,@falanext dm.
3063,2020-01-15,@falanext que tarifa é essa pra compras parceladas? Se eu parcelo uma compra na loja vcs me cobram? Oo 
3064,2020-01-15,@falanext tá lindo o app ARRASARAM 
3065,2020-01-15,É banco classico disfarçado de banco digital É tudo Bradesco
3066,2020-01-15,"Oi, tudo bem? Peço desculpas pelo ocorrido, o nosso time tá focado em melhorias e não queremos causar transtornos. Como posso ajudar? Se preferir, me chama por DM!"
3067,2020-01-15,já chamei.
3068,2020-01-15,"Ah, sempre a mesma coisa, tô quase indo pro @nubank, até carta eles já mandaram"
3069,2020-01-15,"Sim,olhei em tudo e não chega Preciso dele quero desbloquear meu cartão "
3070,2020-01-15,e a @falanext que me mandou um mimo de 20 reais de desconto no uber? eu tava tao atrasado obg meu amo te amo
3071,2020-01-15,Melhorou muito.
3072,2020-01-15,To sem dinheiro
3073,2020-01-15,"Aee, ficamos felizes em saber que vc curtiu! "
3074,2020-01-15,"Poxa, que legal que vc gostou. Conta com a gente! "
3075,2020-01-15,"Muito obrigada pela sugestão, em breve teremos novidades!"
3076,2020-01-15,"Em breve estará disponível, acompanha as novidades no nosso app e redes sociais!"
3077,2020-01-15,Que bom que vc curtiu! Conte sempre com a gente. 
3078,2020-01-15,O que acontece? Me chama na DM se preferir!
3079,2020-01-15, 
3080,2020-01-15, 
3081,2020-01-15,"Olá! Poxa, nos desculpe por isso. Estamos focados em melhorias, visando tornar ainda melhor a experiência de cada cliente. Vc conseguiu contato? Caso não, chama na DM, por favor."
3082,2020-01-15,"Olá! O código é enviado para o seu e-mail de cadastro, vc já consultou o seu lixo eletrônico ou caixa de spam?"
3083,2020-01-15,"Ah, que legal que vc curtiu! Em breve teremos mais novidades, muito obrigada pela sugestão."
3084,2020-01-15, 
3085,2020-01-15,Muito obrigada pela sugestão! 
3086,2020-01-15,"Ah, que bom que vc curtiu! Em breve teremos novidades, continue acompanhando a gente nas redes sociais. "
3087,2020-01-15,"Ah, que bom que vc gostou! "
3088,2020-01-15,"Oie! As reanálises para aumento do limite já estão acontecendo, aí caso o seu aumente, nós te avisamos no app."
3089,2020-01-15,eu ligo pro sac me encaminham pra um número de Whatsapp que me encaminha de volta pro sac ai eu ligo pra ouvidoria e manda eu fazer uma reclamação CUSTA TER ACESSIBILIDADE QUE FUNCIONE?
3090,2020-01-15,"Olá, Gabriel! O que aconteceu? Posso te ajudar?"
3091,2020-01-15,"Olá! Qual a versão do seu app, por favor?"
3092,2020-01-15,"Ah, que bom que vc curtiu! Conte sempre com a gente. "
3093,2020-01-15,"Não, apenas de segunda à sexta, desde que não seja feriado."
3094,2020-01-15,"Olá! Nos desculpe pelo ocorrido. Me chama na DM pra eu te ajudar, por favor?"
3095,2020-01-15,"Olá! Qual a sua cesta de serviços, por favor?"
3096,2020-01-15,"No face nós estamos como ""banco next"" e no insta como ""instadonext"". "
3097,2020-01-15,"Olá! Te respondi na DM, olha lá, por favor."
3098,2020-01-15,"Te respondi na DM, olha lá, por favor."
3099,2020-01-15,Libers meu limite até meio-dia. Eu preciso comprar um relogiooooooooooo
3100,2020-01-15,Cara tenta abrir uma reclamação no banco central. Eles tem canal para reclamação. Talvez resolva mais rápido
3101,2020-01-15,"Olá, Gustavo! Poxa, o que aconteceu? Posso te ajudar?"
3102,2020-01-15,"Uhuu, seja bem-vinda ao next! "
3103,2020-01-15,Que bom que vc curtiu! 
3104,2020-01-15,"Olá! Chama a gente na DM, por gentileza."
3105,2020-01-15,"Olá! O depósito foi em dias úteis? Verifica o lado poupança da conta, por gentileza."
3106,2020-01-15,"Ficou muto melhor,principalmente pra ver o saldo ."
3107,2020-01-15,"Olá, Iran! Tudo bem? Pedimos desculpas pelo transtorno causado, estamos trabalhando em melhorias. Como podemos te ajudar?"
3108,2020-01-15,Mas assim é complicado eu tenho limite outros cartões e eles vão aumentando e até agora de vocês nos deram nem r$100 de limite para mim poder ver como é meu comportamento e meu limite nos outros cartões não é pouco não
3109,2020-01-15,"Ajudo! Te respondi na DM, olha lá."
3110,2020-01-15,Olá! Como podemos te ajudar?
3111,2020-01-15,Aguardando
3112,2020-01-15,Ainda estou aguardando
3113,2020-01-15,Quase um ano usando o Next e nunca me liberaram o crédito... Aff
3114,2020-01-15,@falanext preciso de ajuda to tentando abrir conta e o apl não consegue tirar foto do verso da minha cnh travou nesta tela e não tem nem opção de sair ou voltar me ajude@por favor 
3115,2020-01-15,"Olá, Guilherme! Aqui pelas redes sociais nós não temos acesso a sua conta, entra no chat pela opção ""Ajuda"" do App pra falar com um de nossos Especialistas."
3116,2020-01-15,"Oh, Deus, não me deixa pegar ranço do next não, por favor. @falanext meu app não tá funcionando e não consigo falar com ninguém desde a manhã. Pelo amor da nossa senhora da bicicletinha, me ajuda pq eu preciso usar o app."
3117,2020-01-15,Vou é lá ver se meu cadastro no @falanext ainda tá valendo
3118,2020-01-15,Nem o meu! Não aguento mais! O dia todinho e meu dinheiro PRESO LÁ.
3119,2020-01-15,MEU APLICATIVO NÃO ESTÁ FUNCIONANDO
3120,2020-01-15,E o @falanext que fez nossa dívida de R$130 virar uns R$300 com um parcelamento que não foi solicitado!!
3121,2020-01-15,Olá! Como podemos te ajudar?
3122,2020-01-15,Olá! Chama a gente na DM que iremos te ajudar!
3123,2020-01-15,Melhorou
3124,2020-01-15,@nubank vs @falanext quem ganha? 
3125,2020-01-15,@falanext por que vcs nao enviam o codigo no meu email infernoooo
3126,2020-01-15,"Acreditem se quiser: o @falanext até agora não resolveu minha situação. Dizem que só resolvem no chat, porém a plataforma é isso aí. Uma palhaçada! Não abram conta no Banco Next ou no Bradesco! Recomendo o @nubank, vale esperar te aceitarem. https://twitter.com/GuerraGuilherme/status/1214637436862697479"
3127,2020-01-15,A @falanext me ligando pra cobrar uma conta que já paguei Tome tento
3128,2020-01-14,"@sarahhdias Oi, Sarah! Para que possamos responder sua DM, é necessário seguir nossa página."
3129,2020-01-14,faz 40 minutos que eu to esperando o @falanext resolver um problema pra mim e nada
3130,2020-01-14,Bacana... ótimo! Mas continuo sem acesso ao menu visão geral... se precisarem de ajuda com a parte de dev po$$o ajudar
3131,2020-01-14,Rapaz ficou massa 
3132,2020-01-14,e ai @falanext aprova minha conta ai pfv
3133,2020-01-14,"Minha conta tá fora desde de manhã tomara quando volte, volte com surpresas"
3134,2020-01-14,Adorei a nova atualização e a possibilidade de configurar o painel de forma personalizada! Ah! Ótima sacada em deixar o saldo oculto! 
3135,2020-01-14,"Eu uso o Nubank. São sempre uns amores e resolvem meus problemas rapidinho. EU NEM QUERIA UM CARTÃO NEXT, DEUS SABE LÁ PQ ME MANDARAM UM"
3136,2020-01-14,"Chegou email do Next @falanext dizendo assim ""termine seu cadastro pra ganhar mimos"" pois meu tio lá da sala ""KAROL MIMOS QUER DIZER Q EU VO GANHAR GATOS?"" "
3137,2020-01-14,@falanext me ajudaaaaa
3138,2020-01-14,"New Year, New Bank! Check the #N26, and open your account with my code(jorger0102); you will win 15€. Is a completely #free bank account that will give you a #Mastercard; amazing #app #ApplePay use: jorger0102 #N26"
3139,2020-01-14,"Alexandre, o fundo Alocação Moderada tem liquidez diária e não temos como garantir um rendimento (rentabilidade passada não é garantia de rentabilidade futura). Caso queira saber mais detalhes sobre os nossos investimentos, vc pode acessar o link abaixo: https://next.me/investimentos"
3140,2020-01-14,"Meu cartão next não funciona mais no gpay faz mais de um mês, já abri várias solicitações e nada! por favor me ajudem "
3141,2020-01-14,Atualização bacana @falanext . 
3142,2020-01-14,Oi! Sabemos dos pontos de melhorias e estamos atuando. Valeu pelo feedback!
3143,2020-01-14,"Oie! Vamos verificar, chama na DM por favor."
3144,2020-01-14,"@ReclameAQUI como faço pro @falanext parar de me mandar email? Já pedi a eles por email (inclusive corrigi a mensagem deles, que estava indicando um endereço inexistente), já pedi por DM aqui no Twitter, mas eles não se tocam!!! Socorro!!!"
3145,2020-01-14,@falanext só me traz problema
3146,2020-01-14,"Sabe aquela pessoa chata, que não se toca, não entende um bom ""não"" mesmo depois de várias vezes? Então, o @falanext é assim. Será que vai ser igual quando eu quiser terminar com o @timeneon ou @nubank ou @C6Bank ? #chegadespam"
3147,2020-01-14,"Oi, José! Poxa, ainda não é possível reabrir a conta, mas em breve estará disponível ;)"
3148,2020-01-14,"Olha o app do cartão Bradesco eh sofrível, coisa de banco atrasado mesmo que nem se importa em fazer um app decente"
3149,2020-01-14,"Opa! Ficamos felizes em saber que curtiu, conta com a gente. "
3150,2020-01-14,"Boleto, Apple Pay e mimo para aniversariante... heheheheh"
3151,2020-01-14,"Faltou antecipar fatura, pagar fatura por boleto, o cartão virtual só e pra compras online mais não pra assinaturas poderia ser um cartão virtual pra assinatura também."
3152,2020-01-14,"Estou tentando cancelar minha conta corrente e cartão de crédito não estou conseguindo, já liguei e mandei mensagem no chat e ninguém me responde @falanext"
3153,2020-01-14,"Minha CONTA É DIGITAL. DEVERIA SER GRATUITA. MAS... Avisaram por email q EU FUI ""DISPENSADA DA CESTA""! É MOLE?! @falanext Não querem ABUSAR UM POUCO MAIS?! Detalhe: TODA COBRANÇA INDEVIDA DEVE SER DEVOLVIDA EM DOBRO!!!! Eu sei o caminho dos Juizados Especiais!"
3154,2020-01-14,"A minha INSATISFAÇÃO COM O @falanext É GIGANTESCA. Mês passado, tentei por CHAT e por SAC o ENCERRAMENTO DA CONTA. SÓ PUBLICAMENTE, NO TWITTER, OBTIVE UM FORMULÁRIO DE ENCERRAMENTO. Hoje, tento encerrar. Convenientemente, PROBLEMAS NO SISTEMA. "
3155,2020-01-14,ja faz 84 anos que espero meu cartão @falanext chegar
3156,2020-01-14,"Exatamente, 2020 está aí"
3157,2020-01-14,Esse menu ficou irado!!
3158,2020-01-14,"Oie! Vamos ajudar, chama na DM por favor."
3159,2020-01-14,"Te respondi na DM, dá uma olhada por favor."
3160,2020-01-14,Muito mais funcional e mais agradável. Aquela interface antiga era bem irritante.
3161,2020-01-14,"O aplicativo (até mesmo a versão nova) é bem confuso, não tem notificações de compra e por isso acabava não usando tanto. Já cancelei no chat hoje de manhã."
3162,2020-01-14,Mas eu paguei ipva pelo next
3163,2020-01-14,"Vdd mano, fui no caixa imediato do bradesco e pra surpresa nao aceita no next"
3164,2020-01-14,Quero ganhar meus presentes retroativos entao kkkk
3165,2020-01-14,E apple pay
3166,2020-01-14,Queremos mesmo é mimo hour de freefire outra vez haha
3167,2020-01-14,Só falta a opção de gerar boleto agora!
3168,2020-01-14,Olá! Ainda vamos disponibilizar muitas melhorias e serviços novos no app. Por qual motivo deseja encerrar a conta?
3169,2020-01-14,Olá! Tudo bem? Que bom que vc curtiu o novo visu! Estamos de olho em todas as sugestões e apontamentos que vcs fazem. 
3170,2020-01-14,Agora ficou mas fácil e menos confuso.ficou show.
3171,2020-01-14,"Olá! Poxa! Mas, o que aconteceu?"
3172,2020-01-14,Dica .... Cartão virtual pré-pago para usar em compras online... Só acho... Mas ficou nota 1000 a nova atualização...
3173,2020-01-14,@falanext? 
3174,2020-01-14,"Muito top! Próximas melhorias que fazem falta hj em dia: boleto pra depósito e cartão contactless, de resto vai evoluindo com o tempo. ;P"
3175,2020-01-14,"Muito bom, ficou ótimo."
3176,2020-01-14,Por nada! Qualquer coisa é só chamar. 
3177,2020-01-14,"Banco @falanext olha esse tempo em espera e aguardando ainda pra simplesmente pedir uma segunda via, pqp viu. "
3178,2020-01-14,Oie! Posso ajudar em algo?
3179,2020-01-14,Podia ter a opção de pagar o ipva
3180,2020-01-14,Apoio essa idéia pensa com carinho @falanext
3181,2020-01-14,"Melhorou bastante, continua meio lento, mas já melhorou muito. Só falta a @falanext liberar a função crédito pra eu usar mais o banco."
3182,2020-01-14,
3183,2020-01-14,"Também acho que seria bom ter um ""Internet banking"". É uma alternativa no caso de algum impedimento em acessar o App."
