,date,text
1470,2020-01-23,"A abertura de conta tem o prazo de até 7 dias úteis, e a entrega do cartão na sua região até 10 dias úteis. Mas não vamos te deixar na mão, se sua conta for aprovada, basta ter o código de barras e já conseguirá pagar sem problemas. Fora que já poderá fazer movimentações pelo app"
1471,2020-01-23,"@falanext galera encerrei minha conta ano passado por conta das tarifas e pelo app horrível. Mas após isso vcs zeraram as tarifas e atualizaram o app, que ficou bem legal. Nesses moldes eu me interesso em voltar a ser cliente. Como faço pra me cadastrar novamente?"
1472,2020-01-23,"Mano... Não é o caso de auxílio. Eu já resolvi, já bloqueei e reportei spam. E se eu quisesse sair, mandaria email. Mas o fato é que eu não confio em vocês e suas estratégias de marketing agressivas. Vocês não são honestos. Esse que é o problema."
1473,2020-01-23,"a pessoa manda mensagem pra ajuda do @falanext às 17h e só vão dar uma resposta sobre o assunto MEIA NOITE ou seja quando você já está dormindo, não pode continuar a conversa e eles encerram o atendimento e te mandam de volta pra BIA ou seja: SÓ RAIVA."
1474,2020-01-23,"Se você quiser um suporte com os investimentos, pode ligar no nosso 0800 e escolher a opção 4."
1475,2020-01-23,Já chamei mas vocês não responderam
1476,2020-01-23,"Oie! Te respondi na DM, olha lá!"
1477,2020-01-23,Oq adianta ter um cartão do @falanext se n tenho dinheiro pra por nele 
1478,2020-01-23,Olá! O que aconteceu? Posso te ajudar?
1479,2020-01-23, 
1480,2020-01-23,"Olá! Chama a gente na DM, por gentileza."
1481,2020-01-23,"Matheus, agradecemos pelo feedback, estamos trabalhando em melhorias."
1482,2020-01-23,"Olá! Claro, como posso ajudar?"
1483,2020-01-23,"Oie! Quando vc enviou a proposta no app, por favor?"
1484,2020-01-23, 
1485,2020-01-23,De nada! Seja muito bem-vinda ao next. 
1486,2020-01-23,"Olá! O que acontece quando vc tenta acessar a fatura? Me envia um print na DM, por favor."
1487,2020-01-23,"E eu que tô com medo de abrir o app da @falanext por causa do preço da fatura. Já dizia o poeta, o que os olhos não vêem o coração não sente"
1488,2020-01-23,"Olá! Nos desculpe pelo ocorrido em relação ao atendimento, estamos focados em melhorias. Posso te ajudar por aqui? Chama a gente na DM, por favor."
1489,2020-01-23,"Oie! Poxa, a reabertura de conta não está disponível, mas futuramente será liberada. Acompanha as novidades nas nossas redes sociais."
1490,2020-01-23,"Olá! Novamente nos desculpe por isso. Te respondi no outro comentário, olha lá, por favor."
1491,2020-01-23,"Olá! Peço desculpas pela experiência, estamos focados em melhorias. Posso te ajudar por aqui?"
1492,2020-01-23,"Olá! Nos desculpe por isso. Vc conseguiu contato? Caso não, me chama na DM, por favor."
1493,2020-01-23,"Olá! Peço desculpas pelo ocorrido em relação ao atendimento. Me chama na DM pra eu te ajudar, por favor."
1494,2020-01-23,"Hahaha, muito obrigada pela divulgação! Espero que sua experiência com a gente seja cada vez mais incrível! "
1495,2020-01-23,"Te respondi na DM, olha lá."
1496,2020-01-23,"Uhuu, conta sempre com a gente! "
1497,2020-01-23,"Olá! Qual a versão do app, por gentileza?"
1498,2020-01-23,"Ah, que bom que vc está curtindo! Conta sempre com a gente. "
1499,2020-01-23,Uffa! Qualquer coisa estamos a disposição!
1500,2020-01-23,Olá! O que acontece quando tenta adicionar o cartão? Me chama na DM por favor?
1501,2020-01-23,@falanext abri uma conta e tô em dúvida. Podem me ajudar ?
1502,2020-01-23,"estou em dúvida pra abrir uma conta pra guardar dinheiro, @pagseguro que rende bem, mas relatos que some com o dinheiro das pessoas ou @falanext que também tá com a reputação baixa, me ajudem"
1503,2020-01-23,Olá! Você tentou na função de crédito ou débito?
1504,2020-01-23,"Tava querendo abrir em um banco digital,mas fiquei com medo de não ser aceito em todas as máquinas,só quero um banco pra guardar o dinheiro que eu não tenho,que me deixe ter débito e crédito no mesmo cartão e que não cobre tarifas astronômicas,não é pedir muito cara kkkk"
1505,2020-01-23,"Olá! Nos desculpe pelo ocorrido. Posso ajudar? Se preferir, chama na DM."
1506,2020-01-23,"Não tem um prazo específico, Thiago, já que as análises sempre acontecem."
1507,2020-01-23,"Oie! Você pode chamar no chat (App) na opção ""Ajuda"", assim um especialista consegue auxiliar vc."
1508,2020-01-23,até q fim hein
1509,2020-01-23,"Olá! Para cadastrar em débito automático, é só entrar em contato com a empresa emissora da conta e informar o Banco Bradesco (237) e os dados da sua agência e conta next."
1510,2020-01-23,"Oie! As reanálises para aumento de limite já estão acontecendo, aí caso seu limite aumente, nós te avisamos no app."
1511,2020-01-23,"Olá! Por favor, neste caso acessa a opção ""ajuda"" do app para que verifiquem isso pra vc."
1512,2020-01-23,"Olá! Me chama na DM, por gentileza? Vamos auxiliar vc."
1513,2020-01-23, 
1514,2020-01-23,"Já mandei, procure"
1515,2020-01-23,"Já estamos tratando o caso, obrigado por avisar."
1516,2020-01-23,"Olá! Estamos aguardando algumas informações na DM, assim podemos auxiliar vc."
1517,2020-01-23,Estamos aguardando a sua mensagem via DM.
1518,2020-01-23,"Cara vai pro @falanext que é um banco muito bom, apesar deles não me darem crédito kkk"
1519,2020-01-23,"Minha única preocupação é essa, ss tem uma variedade enorme de bancos"
1520,2020-01-23,O meu tmb reembolsaram. Não fazia questão nenhuma da conta. Ja viu quantas opções temos no mercado de bancos digitais? Eu amo o @falanext super recomendo.
1521,2020-01-23,Sei qual é muito bom
1522,2020-01-23,Usa @falanext meu xodô! Amo meu verdinho 
1523,2020-01-23,"@falanext a BIA é uma piada, só pode"
1524,2020-01-23,Gente que inferno. O cartão da @falanext tá dando erro em todos os sites possíveis. To doida pra me livrar dele e ficar só com o nubank.
1525,2020-01-23,"Olá! Respondi sua DM, dá uma olhadinha, por gentileza."
1526,2020-01-23,"Quero trocar meus cartões de crédito que possuem anuidade (SicoobCard, Caixa e Cabal) por algum sem anuidade. O lance é que tô na dúvida de qual: @Bancointer @C6Bank @meudigio @bancopan @meupag @timeneon @falanext @credicard @BancoOriginal @WoopSicredi "
1527,2020-01-23,"Oie! Sinto muito pela experiência, estamos trabalhando para otimizar nossos canais de relacionamento. A sua conta está bloqueada? Pode enviar um print do contato realizado no chat (App) na DM, por gentileza?"
1528,2020-01-23,"Rapaz, o next tá me estressando mais q a Algar.. Que é pelo menos umas 4x pior q a net"
1529,2020-01-23,atualizações sobre meu cartão do next. DEPOIS DE DOIS MESES CHEGOU @falanext eu merecia um mimo em!
1530,2020-01-22,Olá! Poxa! Pedimos sinceras desculpas pelo transtorno causado no seu atendimento. Pq quer encerrar a conta? O que aconteceu?
1531,2020-01-22,Poxa! Podemos fazer algo para que vc de ideia? 
1532,2020-01-22,"Olá! Vamos te ajudar com a entrega do seu cartão. Chama a gente pela DM, por favor?!"
1533,2020-01-22,"Oloco mano, tem que ser brabo pra ser pior que o da Net, ou ce nunca usou o da net? Auhsuaheuaue"
1534,2020-01-22, 
1535,2020-01-22,Oi! Baixe nosso app na loja de aplicativos do seu celular e envie sua proposta.
1536,2020-01-22, 
1537,2020-01-22,"Se você vai passar tudo no débito, recomendo usar a conta do @falanext. O aplicativo deles tem o ""flow"", que basicamente organiza tuas dispersas por categoria, e da pra vc colocar uma meta de quanto vai gastar... Da pra se organizar legal. Eu amo "
1538,2020-01-22,"Oi, Monique. Mas, qual cesta de serviços vc escolheu?"
1539,2020-01-22,"Agradecemos a sugestão. Em breve teremos mais novidades, fica de olho e acompanha tudo. "
1540,2020-01-22,"Jamais, estou puta por vc"
1541,2020-01-22,Ri da desgraça alheia mesmo
1542,2020-01-22,Cd o link
1543,2020-01-22,Kkkkkkkkkkkkkkkkkkkkk
1544,2020-01-22,"Solicitei a alteração do meu endereço no app do banco, pedi um novo cartão e entregaram o endereço antigo. Que sacanagem em @falanext "
1545,2020-01-22,Hahahahhaha
1546,2020-01-22,"Pô, quero inflar o ego dos amigos"
1547,2020-01-22,"Obrigadaa,esse negócio da vida adulta de ter que escolher um banco não é pra mim kkkk"
1548,2020-01-22,Olá! Pedimos desculpas pelo transtorno causado no seu atendimento. Qual serviço ou informação vc precisa?
1549,2020-01-22,"Cara se eu entendi bem o que eu ví nas fotos, o dinheiro foi para a sua conta do C6 Bank, o Next não possui deposito por boleto só por TED e DOC, dá uma olhada na sua conta do C6 acho que ele está lá "
1550,2020-01-22,Bora @falanext aprova o cartão do amigo aí
1551,2020-01-22,"Bora @falanext , aprova logo meu cartão, quero crédito não, um débito já tá maneiro"
1552,2020-01-22,Comenta @Uber_Brasil
1553,2020-01-22,"Pedimos um @Uber_Brasil e colocamos nosso mimo do @falanext , o motorista iniciou a corrida antes de pegar a gente para forçar o cancelamento, perdemos a corrida, o mimo (pq o app deu como usado) ficamos na chuva, tínhamos saído do metro (perdemos as passagens) TOP de mais :)"
1554,2020-01-22,@falanext POR QUE TÃO RUIM O ATENDIMENTO????????????????? 
1555,2020-01-22,Olá! Ele já chamou a gente por aqui?
1556,2020-01-22,entrou sim. só que ainda não resolveram
1557,2020-01-22,"Me chama na DM, pfv, vou te ajudar por lá."
1558,2020-01-22,Mas em 2020 vou começar a investir também.
1559,2020-01-22,1
1560,2020-01-22,meu deus do ceu que ódio vontade de mudar de banco infernoooooo
1561,2020-01-22,que ódiooo do @falanext
1562,2020-01-22,Aí sim! 
1563,2020-01-22,"Olá, está com dificuldades para falar com equipe do chat? Se preferir, me chama na DM, por favor."
1564,2020-01-22,Parabéns @falanext pelo lançamento do cartão virtual. Melhorando a cada dia. 
1565,2020-01-22,@falanext dá pra vcs me enviarem o email de redefinição de senha pelo amor de deussss eu to o dia inteiro tentando acessar a minha conta
1566,2020-01-22,"Olá, posso sim. Me chama na DM, por favor."
1567,2020-01-22,Olá! Poxa! Pedimos desculpas pelo transtorno causado no seu atendimento. Qual serviço ou informação vc precisa?
1568,2020-01-22,"Oi, Pedro. Ele entrou em contato com a gente?"
1569,2020-01-22, 
1570,2020-01-22,finalmente serei mimada obrigada @falanext 
1571,2020-01-22,OPA! Chamei
1572,2020-01-22,Vocês que lutem!
1573,2020-01-22,Pior cartão da vida! Aplicativo péssimo . Tento a mais de 5 dias acessar a minha fatura e não consigo. Furada
1574,2020-01-22,"Mais de uma hora no telefone pra falarem que eu tenho que esperar até o fim da semana, por que não conseguem fazer mais nada. Realmente consegue ser o pior atendimento que eu recebi na vida"
1575,2020-01-22,O Atendimento do @falanext consegue ser pior que de banco tradicional. Estou a uns 4 dias tentando transferir um dinheiro da minha conta e ele está bloqueado! HAHAHAHAH
1576,2020-01-22,"Aumenta aí o cdb pra uns 92% next nunca te pedi nada, tenho aplicação nos fundos, mas pra curto prazo não dá pra alocar em multimercado né"
1577,2020-01-22,Olá! Respondemos sua DM.
1578,2020-01-22,Qualquer outro banco é melhor que next bradesco
1579,2020-01-22,Quando sua conta foi aberta? Em que região vc mora?
1580,2020-01-22,Oie! Temos opções diversificadas de investimentos que rendem mais. Confere lá!
1581,2020-01-22,Queria saber como troca a data de vencimento do @falanext
1582,2020-01-22,"Oi, boa tarde! O que aconteceu? Posso ajudar em algo?"
1583,2020-01-22,Quem vê até acredita né??? PARA DE ME MANDAR EMAIL @falanext 
1584,2020-01-22,"Oiee! Mesmo que vc trabalhe de forma autónoma, aqui no next vc pode movimentar a conta sem pagar tarifas e com transações ilimitadas. Vc já é cliente? Se não é, baixa o app! "
1585,2020-01-22,É horrível!!!! Nubank>
1586,2020-01-22,"Por qual motivo deseja encerrar sua conta? Me chama na DM para que eu possa te auxiliar por lá, por favor."
1587,2020-01-22,"@falanext ainda continuo recebendo email de vcs. Pfv ""Me tira da lista"""
1588,2020-01-22,"E eu não vou passar nervoso no SAC de vocês, que é horrível e demora um monte"
1589,2020-01-22,"Pois foi feito um pagamento via boleto bancário que eu emiti na minha conta next, e mesmo assim eu não recebi o valor na minha conta. Isso caracteriza roubo sim, e já tô tratando na justiça"
1590,2020-01-22,"E por que eu não mando email? Por que eles fizeram isso por meses, me mandando SMS. Eu enviava ""sair"" e eles ignoravam."
1591,2020-01-22,"E o @falanext que não disponibiliza link pra se descadastrar? Te obriga a enviar um e-mail. Recomendo denunciar como spam, assim todos os outros vão pro spam também. "
1592,2020-01-22,To usando o @falanext pra tudo! E simplesmente foi a melhor coisa que fiz! Ainda recomendo pra todos kk obg!
1593,2020-01-22,"Oi, boa tarde! Obrigado pelo feedback! Já estamos realizando ajustes para as próximas versões do app ;)"
1594,2020-01-22,"Tô gostando de ver esse @falanext , cada dia uma função nova!"
1595,2020-01-22,"Oi, boa tarde! Vc realizou o pagamento da fatura na data de vencimento? Se sim, há um prazo médio de 72hrs para atualização sistêmica."
1596,2020-01-22,1 e 2..
1597,2020-01-22,Oi! Peço desculpas pelo transtorno! Respondi o seu outro tuíte.
1598,2020-01-22,Te respondi no outro tuíte.
1599,2020-01-22,Vamos te ajudar! Te respondi no outro tuíte.
1600,2020-01-22,Respondi o seu outro tuíte.
1601,2020-01-22,"Oi! Vamos verificar essa informação. Onde vc foi informada, por favor?"
1602,2020-01-22,Oi! O que aconteceu?
1603,2020-01-22,"Vocês poderiam ouvir direto , ai não teria problemas"
1604,2020-01-22,Vc precisa chamar a gente por DM para que possamos entender melhor o ocorrido.
1605,2020-01-22,"Oi, Giasi! Bom, pelo que consegui identificar nas fotos que vc encaminhou, o valor de R$45,00 foi debitado de um banco e creditado no Bradesco, ou seja, não é depósito. Na segunda foto que vc mandou, é apresentado o débito de R$45,00 com a descrição: PAGTO COBRANÇA."
1606,2020-01-22,Problema resolvido @falanext ;)
1607,2020-01-22,"Oi, tudo bem? Vc pode me chamar por DM? Vou te ajudar."
1608,2020-01-22,"Me chama na DM, pfv, vou te ajudar por lá."
1609,2020-01-22,"Oi! Me chama por DM, irei te ajudar!"
1610,2020-01-22,"Oi, tudo bem? O next é um banco fiscalizado pelo BACEN (Banco Central) e estamos tratando todas as reclamações. Vc pode me chamar por DM com mais detalhes do ocorrido, pf?"
1611,2020-01-22,"Oi, boa tarde! Obrigado pelo feedback! Caso o seu cartão tenha somente a função de débito ativa, é necessário acessar a opção ""Ajuda"" e solicitar o cancelamento diretamente com um gerente. Já estamos trabalhando para implantar essa funcionalidade no app."
1612,2020-01-22,"@falanext oie! já fui cliente de vocês há uns anos atrás mas optei por encerrar a conta por inatividade... agora anos depois, a saudade bateu &lt;3 kkk, posso voltar a ser cliente do banco? :p"
1613,2020-01-22,"Não tem necessidade mais, mas fica o registro pra vocês, realmente espero que ocorram melhorias, pois ta precário"
1614,2020-01-22,Que isso hahahhahahhahhaha
1615,2020-01-22,@Kaueb_69 pegaxx lkkkk
1616,2020-01-22,Desde 9h da manhã tentando resolver um problema na conta do @falanext via chat do app e nada até agora. Mereço viu
1617,2020-01-22,"Oi, Matheus! Me chama na DM, pfv, vou te ajudar por lá."
1618,2020-01-22,"Matheus, sinto muito pela experiência, estamos trabalhando em melhorias para o atendimento. De qual serviço ou informação vc precisa?"
1619,2020-01-22,Me cobraram quase 50% de mora
1620,2020-01-22,Essa análise é feita te quando em quando tempo?
1621,2020-01-22,Cobrança de que?
1622,2020-01-22,"Olá! Poxa, sentimos muito pela sua experiência ruim conosco. Para que possamos te ajudar com o valor do débito, pode nos chamar na DM, por favor?"
1623,2020-01-22,"Alô @Bradesco , vc que gerencia o @falanext Eu gostaria de dizer que recebi uma cobrança bem abusiva da parte de vcs, mas é muito, mas muito difícil conseguir contato pra resolver o problema. Não adianta querer pagar de moderno e continuar assim."
1624,2020-01-22,"Olá, se a transação foi feita por meio de DOC o prazo para crédito é de D+1. Caso ultrapasse esse prazo, será necessário entrar em contato com o banco de origem para verificar o que pode ter ocorrido."
1625,2020-01-22,"Oi, boa tarde! Sinto muito pela experiência. De qual serviço ou informação vc precisa?"
1626,2020-01-22,Obrigado.
1627,2020-01-22,"Me ajuda aí @falanext , não consigo adc meu cartão no Google Pay"
1628,2020-01-22,Aguardando resposta
1629,2020-01-22,Tentando colocar minha conta de água em débito automático atendimento péssimo da @Sabesp E do @falanext
1630,2020-01-22,Pena q vcs não libera mais limite
1631,2020-01-22,"Respondido, confere lá!"
1632,2020-01-22,@falanext responde minha pergunta por favor....
1633,2020-01-22,"O meu tou tentando resolver desde que fiz minha conta, e o problema é uma coisa super simples, mas já vai fazer um mês que estou tentando resolver e nada."
1634,2020-01-22,1
1635,2020-01-22,"Vamos ajudar! Chama na DM, por favor."
1636,2020-01-22,"De que adianta? Por tds os canais de vcs é sempre a mesma resposta padrão. O serviço q deveria ser pra facilitar, só complica a vida. E justamente por isso, tô encerrando minha conta c vocês e aí outra burocracia surge. Que daqui p frente vcs melhorem sem precisar perder cliente"
1637,2020-01-22,segunda vez q meu cartao da @falanext volta pro remetente pq fala q o endereço ta errado sendo que absolutamente TODAS as encomendas e contas chegam nesse mesmo endereço.... transportadora lixo q eles contrataram
1638,2020-01-22,desconsidera @falanext
1639,2020-01-22,@falanext Chegou 
1640,2020-01-22,"Olá! Poxa, o que aconteceu? Posso te ajudar em algo?"
1641,2020-01-22,"O prazo de resposta é de 3 à 7 dias úteis. Se já passou o prazo, chama na DM, por favor."
1642,2020-01-22,Fui compartilhar esse tweet com o @NeivaFromTheSky e acabei mandando pro @falanext A VERGONHA MEU PAI - e eu não consigo apagar da cvs 
1643,2020-01-22,30 minutos.
1644,2020-01-22,"@falanext Cartão Virtual. Era uma das coisas que estava faltando para deixar o app e as funcionalidades mais completas. Anota aí, próximo passo: Saldo da Conta deixar rendendo 100% do CDI #FicaDica Continuem melhorando. Quem sabe eu deixo o ""roxinho"" "
1645,2020-01-22,"Olá, respondemos a DM que vc enviou. Dá uma conferida, por favor."
1646,2020-01-22,"Estou a 57 minutos esperando um especialista no chat do @falanext e ninguém me responde. Ai liguei, me transferiram para o setor responsável e estou a 20 minutos ouvindo musiquinha."
1647,2020-01-22,"Poxa, porque? Como posso ajudar?"
1648,2020-01-22,"Oi,me responda na DM"
1649,2020-01-22,"O atendimento do @falanext é horrível, pqp"
1650,2020-01-22,"Oi, tudo bem? Vc pode me chamar por DM e contar o que aconteceu, pf?"
1651,2020-01-22,"Oi, tudo bem? Me chama por DM, pf!"
1652,2020-01-22,"Oi, tudo bem? Peço desculpas pelo ocorrido, vc pode me chamar por DM e me contar o que aconteceu com mais detalhes, pf?"
1653,2020-01-22,ja enviei selfie. ja recuperei senha. so nao consigo logar no app
1654,2020-01-22,"Vc já encaminhou a selfie? Se sim, é necessário checar o e-mail para obter o código de recuperação da conta."
1655,2020-01-22,Os 3 
1656,2020-01-22,Obrigada.
1657,2020-01-22,esse chat automatico do @falanext é tão enrolado meu deus
1658,2020-01-22,"Olá! Para ter acesso a todos os serviços de forma gratuita e ilimitada é necessário escolher a ""Cesta next"" no app."
1659,2020-01-22,vou dar uma olhada no Original então
1660,2020-01-22,"Oi, tudo bem? São as taxas que são cobradas se caso vc contratar algum produto do cartão de crédito, como por exemplo, o rotativo ou o parcelamento fácil."
1661,2020-01-22,"Alô @Bancointer, ajuda aqui nois"
1662,2020-01-22,o pessoal do @Bancointer podiam me ajudar mais nessa. banco inter ♡
1663,2020-01-22,Oi! O que aconteceu?
1664,2020-01-22,OOOOOOOOO mas que arrombados
1665,2020-01-22,"Esse mimo era especificamente para clientes com limite disponível, sendo que o app da uber não contabilizava o desconto quando se selecionava a opção de débito para pagamento. Mas chama a gente na DM, por gentileza."
1666,2020-01-22,"Respondemos vc, confere lá!"
1667,2020-01-22,Cancelem a conta do meu amiro
1668,2020-01-22,3
1669,2020-01-22, 
1670,2020-01-22,"Oie, te peço desculpas pela demora, =/ Respondi sua DM!"
1671,2020-01-22,Daria pra investir mais se o cdb não fosse 85% e rendesse menos que a poupança
1672,2020-01-22,"Pra começar a história,não tenho salario, fim"
1673,2020-01-22,"@falanext está cancelada pra mim, com muita dor no coração.... mas já passei raiva durante 2 meses!"
1674,2020-01-22,"Oi, tudo bem? Vc pode me chamar por DM, pf?"
1675,2020-01-22,"Oi, tudo bem? Aqui no next vc pode movimentar a conta sem pagar tarifas e com transações ilimitadas, como: TED/DOC, Saques e Transferencias. É só selecionar a cesta de serviços ""Cesta next"". Agora, para antecipar um pagamento de cartão de crédito, é só chamar no chat e solicitar."
1676,2020-01-22,"Opa, só vem "
1677,2020-01-22, e ...
1678,2020-01-22, Pobre
1679,2020-01-22,"Oie! Vc consegue usar o cartão de crédito sem o cupom no app? Se não, é possível que seja um bloqueio pontual na Uber, por isso vc deve verificar com o suporte deles. Caso vc consiga usar o cartão, chama na DM, por favor."
1680,2020-01-22,"Você é do tipo de pessoa que recebe o salário e: Deixa as contas em dia com nosso app Aproveita todos os Mimos pra clientes next Investe grana no next pra realizar sonhos Com o next, você faz tudo isso de forma fácil, ilimitada e sem taxas. https://next.me/trazer-meu-salario"
1681,2020-01-22,"Oi, tudo bem? Lamentamos a demora no atendimento e já estamos trabalhando em melhorias! O que houve com seu cartão, podemos te ajudar por aqui?"
1682,2020-01-22,"Oie! Respondemos seu outro tweet, olha lá, por gentileza."
1683,2020-01-22,"Olá, Respondi seu tweet, da uma olhadinha lá, por favor."
1684,2020-01-22,"Olá! Para que possamos te ajudar, por aqwui, pode nos chamar por DM, por favor?"
1685,2020-01-22,estaria mentindo se dissesse que não chorei
1686,2020-01-22,"obrigado, kerol. é bom o apoio numa hora difícil dessas"
1687,2020-01-22,"Me chama por DM, vou passar algumas orientações e acompanhar o seu caso."
1688,2020-01-22,"Me contrata então, sou estudante de T.I. e o erro de vocês foi no sistema."
1689,2020-01-22,"Bom dia, Letícia! Te peço desculpas por essa situação =/ O que aconteceu? Como posso te ajudar?"
1690,2020-01-22,"Bem não tá, vcs colocaram no sistema q estava faltando um documento meu, mas n estava. Após horas no call center de vcs consegui resolver. Obrigado por nada"
1691,2020-01-22,"Oi, tudo bem? Peço desculpas pelo ocorrido, o nosso time tá focado em melhorias. Se precisar de ajuda, me chama por DM!"
1692,2020-01-22,"Oi, tudo bem? Já respondemos os seus outros tweets, confere lá!!"
1693,2020-01-22,"Oi, tudo bem? Já respondemos os seus outros tweets, confere lá!"
1694,2020-01-22,"Vc já chamou no chat do app? Se sim, me manda uma DM, pf! Vou te ajudar."
1695,2020-01-22,"Oi, tudo bem? Vou te ajudar com isso, me chama no DM!"
1696,2020-01-22,"Me chama por DM, pf!"
1697,2020-01-22,"Olá! Para que possamos olicitar uma reanálise de crédito, nos chame por DM, por favor."
1698,2020-01-22,Next desgraçada libera meu limite que eu já pagay a fatura @falanext
1699,2020-01-22,Eles que lutem 
1700,2020-01-22,"@falanext pq eu preciso dizer meu sexo no cadastro? Poderia pelo menos deixar a opção ""outro"""
1701,2020-01-22,"Olá! Respondi sua DM explicando sua dúvida. Dá uma olhadinha lá, por favor."
1702,2020-01-22,Uhull \o/ Dá uma olhada na opção 'MImos' que fica dentro do app e aproveita os benefícios disponíveis pra vc 
1703,2020-01-22,"Olá, quinta passada."
1704,2020-01-22,Olá! Nós sempre fazemos novas análises e avisaremos se for aprovado! Vai movimentando a conta para conhecermos melhor seus hábitos financeiros!
1705,2020-01-22,"De nada, aproveita muito! "
1706,2020-01-22,"Olá! Neste caso é só aguardar as reanálises de crédito que ocorrem periodicamente e caso seu limite seja liberado, a gente te avisa no app. Não desanima não."
1707,2020-01-22,Olá! O que houve? Como posso te ajudar?
1708,2020-01-22,"Olá! Vc quer fazer aviso viagem para a função crédito? Se sim, é só ir no app em ""cartão"" > ""aviso de viagem""."
1709,2020-01-22,"Olá! Quando vc enviou a proposta no app, por favor?"
1710,2020-01-22,Olá! O que aconteceu? Posso te ajudar?
1711,2020-01-22,"Oie! Poxa, não temos como interferir nas análises de crédito, já que elas acontecem de forma sistêmica e automática. Mas como as reanálises ocorrem periodicamente, aí assim que seu limite for liberado, nós te avisamos no app."
1712,2020-01-22,Olá! Peço sinceras desculpas pela experiência. Respondi sua msg na DM.
1713,2020-01-22,"Olá! A função crédito é liberada mediante a uma análise, caso não seja disponibilizado no início, fica tranquilo que assim que for possível te avisamos que o benefício está liberado."
1714,2020-01-22,Não acredito que até agora não tem opção de gerar segunda via do cartão @falanext direto no app.....
1715,2020-01-22,"Imagina! Caso o limite aumente, te avisamos no app."
1716,2020-01-22,"Olá! Peço desculpas pelo ocorrido. Me chama na DM pra eu te ajudar, por favor."
1717,2020-01-22,"Olá! Te respondi na DM, olha lá, por favor."
1718,2020-01-22,Eeeeeeeeeeu
1719,2020-01-22,Em breve vc receberá o nosso retorno!
1720,2020-01-22,"Olá! Nos desculpe pelo ocorrido. Me chama na DM pra eu te ajudar, por favor."
1721,2020-01-22,"Olá! Novamente peço desculpas pelo ocorrido. Te respondi no outro comentário, olha lá, por favor."
1722,2020-01-22,"Olá! Nos desculpe por isso, estamos focados em melhorias. Me chama na DM pra eu te ajudar, por favor?"
